### ISSUE TITLE
[help!] envoy forwards traffic to the tcp secondary transparent proxy through tcp_proxy, but before envoy receives the response, the tcp secondary transparent proxy sends a FIN and disconnects the connection.

### ISSUE THREAD

**Issue by xiaoxuanyo** [envoyproxy/envoy#34238]
I want to realize the requirements of 【pod outbound -> envoy -> tcp transparent proxy -> target website】

This is my TCP packet capture information:

1. envoy -> tcp transparent proxy
```
17:07:47.649719 IP 10.0.0.136.38184 > iZ7xvj2m1pwoytdowmcrjxZ.7892: Flags [S], seq 808239914, win 64860, options [mss 1410,sackOK,TS val 1842931539 ecr 0,nop,wscale 7], length 0
17:07:47.649765 IP iZ7xvj2m1pwoytdowmcrjxZ.7892 > 10.0.0.136.38184: Flags [S.], seq 490212783, ack 808239915, win 65160, options [mss 1460,sackOK,TS val 1544986883 ecr 1842931539,nop,wscale 7], length 0
17:07:47.649775 IP 10.0.0.136.38184 > iZ7xvj2m1pwoytdowmcrjxZ.7892: Flags [.], ack 1, win 507, options [nop,nop,TS val 1842931539 ecr 1544986883], length 0
17:07:47.649823 IP 10.0.0.136.38184 > iZ7xvj2m1pwoytdowmcrjxZ.7892: Flags [P.], seq 1:78, ack 1, win 507, options [nop,nop,TS val 1842931539 ecr 1544986883], length 77
17:07:47.649831 IP iZ7xvj2m1pwoytdowmcrjxZ.7892 > 10.0.0.136.38184: Flags [.], ack 78, win 509, options [nop,nop,TS val 1544986883 ecr 1842931539], length 0
17:07:50.925246 IP iZ7xvj2m1pwoytdowmcrjxZ.7892 > 10.0.0.136.38184: Flags [F.], seq 1, ack 78, win 509, options [nop,nop,TS val 1544990159 ecr 1842931539], length 0
17:07:50.925381 IP 10.0.0.136.38184 > iZ7xvj2m1pwoytdowmcrjxZ.7892: Flags [F.], seq 78, ack 2, win 507, options [nop,nop,TS val 1842934815 ecr 1544990159], length 0
17:07:50.925405 IP iZ7xvj2m1pwoytdowmcrjxZ.7892 > 10.0.0.136.38184: Flags [.], ack 79, win 509, options [nop,nop,TS val 1544990159 ecr 1842934815], length 0
```
2. tcp transparent proxy -> website
```
17:07:47.666327 IP iZ7xvj2m1pwoytdowmcrjxZ.58672 > 183.36.43.187.21015: Flags [S], seq 635071276, win 64240, options [mss 1460,sackOK,TS val 2142505864 ecr 0,nop,wscale 7], length 0
17:07:47.671942 IP 183.36.43.187.21015 > iZ7xvj2m1pwoytdowmcrjxZ.58672: Flags [S.], seq 3847122411, ack 635071277, win 29200, options [mss 1460,nop,nop,sackOK,nop,wscale 7], length 0
17:07:47.671965 IP iZ7xvj2m1pwoytdowmcrjxZ.58672 > 183.36.43.187.21015: Flags [.], ack 1, win 502, length 0
17:07:47.672220 IP iZ7xvj2m1pwoytdowmcrjxZ.58672 > 183.36.43.187.21015: Flags [P.], seq 1:284, ack 1, win 502, length 283
17:07:47.677818 IP 183.36.43.187.21015 > iZ7xvj2m1pwoytdowmcrjxZ.58672: Flags [.], ack 284, win 237, length 0
17:07:47.838263 IP 183.36.43.187.21015 > iZ7xvj2m1pwoytdowmcrjxZ.58672: Flags [P.], seq 1:4321, ack 284, win 237, length 4320
17:07:47.838311 IP iZ7xvj2m1pwoytdowmcrjxZ.58672 > 183.36.43.187.21015: Flags [.], ack 4321, win 491, length 0
17:07:47.838324 IP 183.36.43.187.21015 > iZ7xvj2m1pwoytdowmcrjxZ.58672: Flags [P.], seq 4321:5657, ack 284, win 237, length 1336
17:07:47.838333 IP iZ7xvj2m1pwoytdowmcrjxZ.58672 > 183.36.43.187.21015: Flags [.], ack 5657, win 485, length 0
17:07:47.839854 IP iZ7xvj2m1pwoytdowmcrjxZ.58672 > 183.36.43.187.21015: Flags [P.], seq 284:348, ack 5657, win 501, length 64
17:07:47.839900 IP iZ7xvj2m1pwoytdowmcrjxZ.58672 > 183.36.43.187.21015: Flags [P.], seq 348:438, ack 5657, win 501, length 90
17:07:47.840015 IP iZ7xvj2m1pwoytdowmcrjxZ.58672 > 183.36.43.187.21015: Flags [P.], seq 438:537, ack 5657, win 501, length 99
17:07:47.845489 IP 183.36.43.187.21015 > iZ7xvj2m1pwoytdowmcrjxZ.58672: Flags [.], ack 348, win 237, length 0
17:07:47.845527 IP 183.36.43.187.21015 > iZ7xvj2m1pwoytdowmcrjxZ.58672: Flags [.], ack 438, win 237, length 0
17:07:47.845699 IP 183.36.43.187.21015 > iZ7xvj2m1pwoytdowmcrjxZ.58672: Flags [.], ack 537, win 237, length 0
17:07:50.924939 IP 183.36.43.187.21015 > iZ7xvj2m1pwoytdowmcrjxZ.58672: Flags [P.], seq 5657:5681, ack 537, win 237, length 24
17:07:50.925007 IP iZ7xvj2m1pwoytdowmcrjxZ.58672 > 183.36.43.187.21015: Flags [.], ack 5681, win 501, length 0
17:07:50.925068 IP 183.36.43.187.21015 > iZ7xvj2m1pwoytdowmcrjxZ.58672: Flags [F.], seq 5681, ack 537, win 237, length 0
17:07:50.925160 IP iZ7xvj2m1pwoytdowmcrjxZ.58672 > 183.36.43.187.21015: Flags [P.], seq 537:561, ack 5682, win 501, length 24
17:07:50.925195 IP iZ7xvj2m1pwoytdowmcrjxZ.58672 > 183.36.43.187.21015: Flags [F.], seq 561, ack 5682, win 501, length 0
17:07:50.930819 IP 183.36.43.187.21015 > iZ7xvj2m1pwoytdowmcrjxZ.58672: Flags [R], seq 3847128093, win 0, length 0
17:07:50.930850 IP 183.36.43.187.21015 > iZ7xvj2m1pwoytdowmcrjxZ.58672: Flags [R], seq 3847128093, win 0, length 0
```

I don’t understand why the tcp secondary proxy disconnected from envoy before receiving a response from the target website.
```
17:07:50.925246 IP iZ7xvj2m1pwoytdowmcrjxZ.7892 > 10.0.0.136.38184: Flags [F.], seq 1, ack 78, win 509, options [nop,nop,TS val 1544990159 ecr 1842931539], length 0
```

According to my understanding, shouldn't the connection to the proxy server be disconnected after the response is returned to envoy? Is this related to the configuration of envoy?
If anyone can help me I would be grateful~

**Comment by zuercher** [comment]
I don't think this is related to Envoy.
