### ISSUE TITLE
new tcp pool still having issues with upstream writes first 

### ISSUE THREAD

**Issue by rgs1** [envoyproxy/envoy#15061]
We picked up #14919 last week and re-enabled the new tcp pool, but still got into a bad state today. (e.g.: Envoy closes connection after upstream writes).

Log excerpts and tcpdump output following in a bit.

cc: @alyssawilk

**Comment by rgs1** [comment]
Here are a few connection attempts from Envoy to is upsteam via 127.0.0.1:

```
IP 127.0.0.1.56080 > 127.0.0.1.3306: Flags [S], seq 3184046673, win 43690, options [mss 65495,sackOK,TS val 1379075108 ecr 0,nop,wscale 9], length 0
IP 127.0.0.1.3306 > 127.0.0.1.56080: Flags [S.], seq 2576645354, ack 3184046674, win 43690, options [mss 65495,sackOK,TS val 1379075108 ecr 1379075108,nop,wscale 9], length 0
IP 127.0.0.1.56080 > 127.0.0.1.3306: Flags [.], ack 1, win 86, options [nop,nop,TS val 1379075108 ecr 1379075108], length 0
IP 127.0.0.1.3306 > 127.0.0.1.56080: Flags [P.], seq 1:91, ack 1, win 86, options [nop,nop,TS val 1379075109 ecr 1379075108], length 90
IP 127.0.0.1.56080 > 127.0.0.1.3306: Flags [.], ack 91, win 86, options [nop,nop,TS val 1379075109 ecr 1379075109], length 0
IP 127.0.0.1.56080 > 127.0.0.1.3306: Flags [F.], seq 1, ack 91, win 86, options [nop,nop,TS val 1379075109 ecr 1379075109], length 0
IP 127.0.0.1.3306 > 127.0.0.1.56080: Flags [F.], seq 91, ack 2, win 86, options [nop,nop,TS val 1379075109 ecr 1379075109], length 0
IP 127.0.0.1.56080 > 127.0.0.1.3306: Flags [.], ack 92, win 86, options [nop,nop,TS val 1379075109 ecr 1379075109], length 0

...

IP 127.0.0.1.56084 > 127.0.0.1.3306: Flags [S], seq 1326604109, win 43690, options [mss 65495,sackOK,TS val 1379076175 ecr 0,nop,wscale 9], length 0
IP 127.0.0.1.3306 > 127.0.0.1.56084: Flags [S.], seq 2400663721, ack 1326604110, win 43690, options [mss 65495,sackOK,TS val 1379076175 ecr 1379076175,nop,wscale 9], length 0
IP 127.0.0.1.56084 > 127.0.0.1.3306: Flags [.], ack 1, win 86, options [nop,nop,TS val 1379076175 ecr 1379076175], length 0
IP 127.0.0.1.3306 > 127.0.0.1.56084: Flags [P.], seq 1:91, ack 1, win 86, options [nop,nop,TS val 1379076175 ecr 1379076175], length 90
IP 127.0.0.1.56084 > 127.0.0.1.3306: Flags [.], ack 91, win 86, options [nop,nop,TS val 1379076175 ecr 1379076175], length 0
IP 127.0.0.1.56084 > 127.0.0.1.3306: Flags [F.], seq 1, ack 91, win 86, options [nop,nop,TS val 1379076176 ecr 1379076175], length 0
IP 127.0.0.1.3306 > 127.0.0.1.56084: Flags [F.], seq 91, ack 2, win 86, options [nop,nop,TS val 1379076176 ecr 1379076176], length 0
IP 127.0.0.1.56084 > 127.0.0.1.3306: Flags [.], ack 92, win 86, options [nop,nop,TS val 1379076176 ecr 1379076176], length 0

...

IP 127.0.0.1.56086 > 127.0.0.1.3306: Flags [S], seq 3122844579, win 43690, options [mss 65495,sackOK,TS val 1379076441 ecr 0,nop,wscale 9], length 0
IP 127.0.0.1.3306 > 127.0.0.1.56086: Flags [S.], seq 241425731, ack 3122844580, win 43690, options [mss 65495,sackOK,TS val 1379076441 ecr 1379076441,nop,wscale 9], length 0
IP 127.0.0.1.56086 > 127.0.0.1.3306: Flags [.], ack 1, win 86, options [nop,nop,TS val 1379076441 ecr 1379076441], length 0
IP 127.0.0.1.3306 > 127.0.0.1.56086: Flags [P.], seq 1:91, ack 1, win 86, options [nop,nop,TS val 1379076441 ecr 1379076441], length 90
IP 127.0.0.1.56086 > 127.0.0.1.3306: Flags [.], ack 91, win 86, options [nop,nop,TS val 1379076441 ecr 1379076441], length 0
IP 127.0.0.1.56086 > 127.0.0.1.3306: Flags [R.], seq 1, ack 91, win 86, options [nop,nop,TS val 1379076441 ecr 1379076441], length 0
```

**Comment by rgs1** [comment]
And logs:

```
[2021-02-16 18:35:40.855][58][debug][pool] [external/envoy/source/common/conn_pool/conn_pool_base.cc:229] trying to create new connection
[2021-02-16 18:35:41.510][57][debug][pool] [external/envoy/source/common/conn_pool/conn_pool_base.cc:490] cancelling pending stream
[2021-02-16 18:35:41.611][58][debug][pool] [external/envoy/source/common/conn_pool/conn_pool_base.cc:229] trying to create new connection
[2021-02-16 18:35:41.757][58][debug][pool] [external/envoy/source/common/conn_pool/conn_pool_base.cc:490] cancelling pending stream
[2021-02-16 18:35:41.980][58][debug][pool] [external/envoy/source/common/conn_pool/conn_pool_base.cc:229] trying to create new connection
[2021-02-16 18:35:42.213][58][debug][pool] [external/envoy/source/common/conn_pool/conn_pool_base.cc:229] trying to create new connection
[2021-02-16 18:35:42.420][58][debug][pool] [external/envoy/source/common/conn_pool/conn_pool_base.cc:229] trying to create new connection
[2021-02-16 18:35:42.603][57][debug][pool] [external/envoy/source/common/conn_pool/conn_pool_base.cc:490] cancelling pending stream
[2021-02-16 18:35:42.626][57][debug][pool] [external/envoy/source/common/conn_pool/conn_pool_base.cc:229] trying to create new connection
[2021-02-16 18:35:42.655][58][debug][pool] [external/envoy/source/common/conn_pool/conn_pool_base.cc:229] trying to create new connection
[2021-02-16 18:35:42.845][58][debug][pool] [external/envoy/source/common/conn_pool/conn_pool_base.cc:229] trying to create new connection
[2021-02-16 18:35:43.240][58][debug][pool] [external/envoy/source/common/conn_pool/conn_pool_base.cc:490] cancelling pending stream
[2021-02-16 18:35:43.449][58][debug][pool] [external/envoy/source/common/conn_pool/conn_pool_base.cc:229] trying to create new connection
[2021-02-16 18:35:43.487][58][debug][pool] [external/envoy/source/common/conn_pool/conn_pool_base.cc:229] trying to create new connection
[2021-02-16 18:35:43.492][57][debug][pool] [external/envoy/source/common/conn_pool/conn_pool_base.cc:490] cancelling pending stream
[2021-02-16 18:35:43.643][58][debug][pool] [external/envoy/source/common/conn_pool/conn_pool_base.cc:229] trying to create new connection
[2021-02-16 18:35:43.643][58][debug][pool] [external/envoy/source/common/conn_pool/conn_pool_base.cc:132] creating a new connection
[2021-02-16 18:35:43.644][58][debug][pool] [external/envoy/source/common/conn_pool/conn_pool_base.cc:262] [C14422313] attaching to next stream
[2021-02-16 18:35:43.644][58][debug][pool] [external/envoy/source/common/conn_pool/conn_pool_base.cc:160] [C14422313] creating stream
[2021-02-16 18:35:43.644][58][debug][pool] [external/envoy/source/common/conn_pool/conn_pool_base.cc:380] [C14422313] client disconnected, failure reason:
[2021-02-16 18:35:43.644][58][debug][pool] [external/envoy/source/common/conn_pool/conn_pool_base.cc:189] [C14422313] destroying stream: 0 remaining
[2021-02-16 18:35:43.856][58][debug][pool] [external/envoy/source/common/conn_pool/conn_pool_base.cc:490] cancelling pending stream
[2021-02-16 18:35:43.978][57][debug][pool] [external/envoy/source/common/conn_pool/conn_pool_base.cc:229] trying to create new connection
[2021-02-16 18:35:44.237][58][debug][pool] [external/envoy/source/common/conn_pool/conn_pool_base.cc:229] trying to create new connection
```

**Comment by alyssawilk** [comment]
"so canceling pending stream" happens when the downstream side of the connection disconnects while the upstream connection is being established.  Doesn't mean the new pool is not at fault, but I'm wondering what the stats/logs say about the connection?  
Also it occurs to me super belatedly, are you using the tcp proxy session or the mysql code?

**Comment by rgs1** [comment]
> "so canceling pending stream" happens when the downstream side of the connection disconnects while the upstream connection is being established. Doesn't mean the new pool is not at fault, but I'm wondering what the stats/logs say about the connection?
> Also it occurs to me super belatedly, are you using the tcp proxy session or the mysql code?

In Envoy tcp proxy, not using the mysql filter is that what you are asking... The upstream is mysql directly over the loopback...

**Comment by alyssawilk** [comment]
ok, we think we have this sorted - I'm going to close this off and flip the new pool on after the release. :-)

**Comment by rgs1** [comment]
Alright, it happened again:

```
[2021-04-22 20:13:04.804][61][trace][pool] [external/envoy/source/common/conn_pool/conn_pool_base.cc:128] not creating a new connection, shouldCreateNewConnection returned false.
[2021-04-22 20:13:05.608][61][debug][pool] [external/envoy/source/common/conn_pool/conn_pool_base.cc:502] cancelling pending stream
[2021-04-22 20:13:06.031][63][debug][pool] [external/envoy/source/common/conn_pool/conn_pool_base.cc:502] cancelling pending stream
[2021-04-22 20:13:06.046][61][debug][pool] [external/envoy/source/common/conn_pool/conn_pool_base.cc:240] trying to create new connection
[2021-04-22 20:13:06.046][61][trace][pool] [external/envoy/source/common/conn_pool/conn_pool_base.cc:241] ConnPoolImplBase 0x56c5bf2a8990, ready_clients_.size(): 0, busy_clients_.size(): 0, connecting_clients_.size(): 0, connecting_stream_capacity_: 20, num_active_streams_: 0, pending_streams_.size(): 16 per upstream preconnect ratio: 1
[2021-04-22 20:13:06.046][61][trace][pool] [external/envoy/source/common/conn_pool/conn_pool_base.cc:128] not creating a new connection, shouldCreateNewConnection returned false.
[2021-04-22 20:13:06.290][63][debug][pool] [external/envoy/source/common/conn_pool/conn_pool_base.cc:502] cancelling pending stream
[2021-04-22 20:13:06.631][61][debug][pool] [external/envoy/source/common/conn_pool/conn_pool_base.cc:502] cancelling pending stream
[2021-04-22 20:13:06.769][63][debug][pool] [external/envoy/source/common/conn_pool/conn_pool_base.cc:502] cancelling pending stream
[2021-04-22 20:13:06.808][61][debug][pool] [external/envoy/source/common/conn_pool/conn_pool_base.cc:240] trying to create new connection
[2021-04-22 20:13:06.808][61][trace][pool] [external/envoy/source/common/conn_pool/conn_pool_base.cc:241] ConnPoolImplBase 0x56c5bf2a8990, ready_clients_.size(): 0, busy_clients_.size(): 0, connecting_clients_.size(): 0, connecting_stream_capacity_: 20, num_active_streams_: 0, pending_streams_.size(): 16 per upstream preconnect ratio: 1
[2021-04-22 20:13:06.809][61][trace][pool] [external/envoy/source/common/conn_pool/conn_pool_base.cc:128] not creating a new connection, shouldCreateNewConnection returned false.
[2021-04-22 20:13:06.882][61][debug][pool] [external/envoy/source/common/conn_pool/conn_pool_base.cc:502] cancelling pending stream
[2021-04-22 20:13:06.966][61][debug][pool] [external/envoy/source/common/conn_pool/conn_pool_base.cc:240] trying to create new connection
[2021-04-22 20:13:06.966][61][trace][pool] [external/envoy/source/common/conn_pool/conn_pool_base.cc:241] ConnPoolImplBase 0x56c5bf2a8990, ready_clients_.size(): 0, busy_clients_.size(): 0, connecting_clients_.size(): 0, connecting_stream_capacity_: 20, num_active_streams_: 0, pending_streams_.size(): 16 per upstream preconnect ratio: 1
[2021-04-22 20:13:06.966][61][trace][pool] [external/envoy/source/common/conn_pool/conn_pool_base.cc:128] not creating a new connection, shouldCreateNewConnection returned false.
[2021-04-22 20:13:07.703][63][debug][pool] [external/envoy/source/common/conn_pool/conn_pool_base.cc:240] trying to create new connection
[2021-04-22 20:13:07.703][63][trace][pool] [external/envoy/source/common/conn_pool/conn_pool_base.cc:241] ConnPoolImplBase 0x56c5bf2a8cc0, ready_clients_.size(): 0, busy_clients_.size(): 0, connecting_clients_.size(): 0, connecting_stream_capacity_: 41, num_active_streams_: 0, pending_streams_.size(): 35 per upstream preconnect ratio: 1
[2021-04-22 20:13:07.703][63][trace][pool] [external/envoy/source/common/conn_pool/conn_pool_base.cc:128] not creating a new connection, shouldCreateNewConnection returned false.
[2021-04-22 20:13:07.807][61][debug][pool] [external/envoy/source/common/conn_pool/conn_pool_base.cc:502] cancelling pending stream
[2021-04-22 20:13:08.076][61][debug][pool] [external/envoy/source/common/conn_pool/conn_pool_base.cc:240] trying to create new connection
[2021-04-22 20:13:08.076][61][trace][pool] [external/envoy/source/common/conn_pool/conn_pool_base.cc:241] ConnPoolImplBase 0x56c5bf2a8990, ready_clients_.size(): 0, busy_clients_.size(): 0, connecting_clients_.size(): 0, connecting_stream_capacity_: 20, num_active_streams_: 0, pending_streams_.size(): 16 per upstream preconnect ratio: 1
[2021-04-22 20:13:08.076][61][trace][pool] [external/envoy/source/common/conn_pool/conn_pool_base.cc:128] not creating a new connection, shouldCreateNewConnection returned false.
[2021-04-22 20:13:08.118][61][debug][pool] [external/envoy/source/common/conn_pool/conn_pool_base.cc:240] trying to create new connection
[2021-04-22 20:13:08.118][61][trace][pool] [external/envoy/source/common/conn_pool/conn_pool_base.cc:241] ConnPoolImplBase 0x56c5bf2a8990, ready_clients_.size(): 0, busy_clients_.size(): 0, connecting_clients_.size(): 0, connecting_stream_capacity_: 20, num_active_streams_: 0, pending_streams_.size(): 17 per upstream preconnect ratio: 1
[2021-04-22 20:13:08.118][61][trace][pool] [external/envoy/source/common/conn_pool/conn_pool_base.cc:128] not creating a new connection, shouldCreateNewConnection returned false.
[2021-04-22 20:13:08.621][61][debug][pool] [external/envoy/source/common/conn_pool/conn_pool_base.cc:240] trying to create new connection
[2021-04-22 20:13:08.621][61][trace][pool] [external/envoy/source/common/conn_pool/conn_pool_base.cc:241] ConnPoolImplBase 0x56c5bf2a8990, ready_clients_.size(): 0, busy_clients_.size(): 0, connecting_clients_.size(): 0, connecting_stream_capacity_: 20, num_active_streams_: 0, pending_streams_.size(): 18 per upstream preconnect ratio: 1
[2021-04-22 20:13:08.621][61][trace][pool] [external/envoy/source/common/conn_pool/conn_pool_base.cc:128] not creating a new connection, shouldCreateNewConnection returned false.
[2021-04-22 20:13:09.046][61][debug][pool] [external/envoy/source/common/conn_pool/conn_pool_base.cc:502] cancelling pending stream
^C
```

**Comment by alyssawilk** [comment]
Aha!  That debug log is _super_ useful. 
What it tells me is that there was a bug updating connecting stream capacity.
Here, there's no connecting clients, no ready clients, but connecting capacity is unexpectedly 20 (there's debug ASSERTS for that, but they weren't caught in test)

ConnPoolImplBase 0x56c5bf2a8990, ready_clients_.size(): 0, busy_clients_.size(): 0, connecting_clients_.size(): 0, connecting_stream_capacity_: 20, num_active_streams_: 0, pending_streams_.size(): 18 per upstream preconnect ratio: 1

I spent _all morning_ trying to repro this darned thing before realizing that I'm pretty confident https://github.com/envoyproxy/envoy/pull/14855  fixed.

when we create a new client, we increment the connecting capacity.
When a connecting client either gets a connection event, or gets a disconnect event, it decrements the capacity.

What was broken, was that if the client disconnects, and the tcp proxy session cancels the "fetch me a connection", the tcp proxy session cancels with CloseExcess.  This causes the client to transition to draining (https://github.com/envoyproxy/envoy/blob/main/source/common/conn_pool/conn_pool_base.cc#L517) and three weeks back it means that when it picked up the disconnect here (https://github.com/envoyproxy/envoy/blob/main/source/common/conn_pool/conn_pool_base.cc#L377) it wouldn't decrement.  We'd then "leak" connecting capacity, and when new streams came in, the pool would be convinced there was upcoming capacity and not fetch new connections

The fix, for H2 goaway, was to update the capacity when draining* which is why I spent all morning failing to repro because it should no longer leak.

Whew!


*https://github.com/envoyproxy/envoy/blob/main/source/common/conn_pool/conn_pool_base.h#L92
 and  https://github.com/envoyproxy/envoy/blob/main/source/common/conn_pool/conn_pool_base.cc#L579

**Comment by rgs1** [comment]
This is great, thanks so much for the detailed explanation and the fix! We are switching the new tcp pool back on in our deployments, hopefully after that we can turn it on here in upstream too. Thanks!

**Comment by rgs1** [comment]
> I spent all morning trying to repro this darned thing before realizing that I'm pretty confident #14855 fixed.

You mean #15792
