### ISSUE TITLE
Envoy can't handle request

### ISSUE THREAD

**Issue by shaneing** [envoyproxy/envoy#14500]
*Title*: *Envoy can't handle request*

*Description*:

```
bash-5.0# netstat -tlpn
Active Internet connections (only servers)
Proto Recv-Q Send-Q Local Address           Foreign Address         State       PID/Program name
tcp      129      0 0.0.0.0:15021           0.0.0.0:*               LISTEN      15/envoy
tcp        0      0 0.0.0.0:15090           0.0.0.0:*               LISTEN      15/envoy
tcp        0      0 127.0.0.1:15000         0.0.0.0:*               LISTEN      15/envoy
tcp       37      0 0.0.0.0:15001           0.0.0.0:*               LISTEN      15/envoy
tcp        0      0 0.0.0.0:15006           0.0.0.0:*               LISTEN      15/envoy
tcp        0      0 :::15020                :::*                    LISTEN      1/pilot-agent
tcp        0      0 :::80                   :::*                    LISTEN      -
```

```
bash-5.0# tcpdump -i eth0 -X -A 'dst port 15021'
tcpdump: verbose output suppressed, use -v or -vv for full protocol decode
listening on eth0, link-type EN10MB (Ethernet), capture size 262144 bytes
10:35:37.259746 IP 10-202-83-40.kubernetes.default.svc.cluster.local.37756 > service-rev-proxy-578c69574-knmwz.15021: Flags [S], seq 3232659061, win 29200, options [mss 1460,sackOK,TS val 3572344930 ecr 0,nop,wscale 7], length 0
	0x0000:  4500 003c 1d23 4000 4006 37aa 0aca 5328  E..<.#@.@.7...S(
	0x0010:  0ae9 7d14 937c 3aad c0ae 7675 0000 0000  ..}..|:...vu....
	0x0020:  a002 7210 e61d 0000 0204 05b4 0402 080a  ..r.............
	0x0030:  d4ed a862 0000 0000 0103 0307            ...b........
10:35:38.260800 IP 10-202-83-40.kubernetes.default.svc.cluster.local.37756 > service-rev-proxy-578c69574-knmwz.15021: Flags [S], seq 3232659061, win 29200, options [mss 1460,sackOK,TS val 3572345932 ecr 0,nop,wscale 7], length 0
	0x0000:  4500 003c 1d24 4000 4006 37a9 0aca 5328  E..<.$@.@.7...S(
	0x0010:  0ae9 7d14 937c 3aad c0ae 7675 0000 0000  ..}..|:...vu....
	0x0020:  a002 7210 e61d 0000 0204 05b4 0402 080a  ..r.............
	0x0030:  d4ed ac4c 0000 0000 0103 0307            ...L........
10:35:40.260006 IP 10-202-83-40.kubernetes.default.svc.cluster.local.37804 > service-rev-proxy-578c69574-knmwz.15021: Flags [S], seq 3683748075, win 29200, options [mss 1460,sackOK,TS val 3572347931 ecr 0,nop,wscale 7], length 0
	0x0000:  4500 003c ffe4 4000 4006 54e8 0aca 5328  E..<..@.@.T...S(
	0x0010:  0ae9 7d14 93ac 3aad db91 88eb 0000 0000  ..}...:.........
	0x0020:  a002 7210 e61d 0000 0204 05b4 0402 080a  ..r.............
	0x0030:  d4ed b41b 0000 0000 0103 0307            ............
10:35:41.268827 IP 10-202-83-40.kubernetes.default.svc.cluster.local.37804 > service-rev-proxy-578c69574-knmwz.15021: Flags [S], seq 3683748075, win 29200, options [mss 1460,sackOK,TS val 3572348940 ecr 0,nop,wscale 7], length 0
	0x0000:  4500 003c ffe5 4000 4006 54e7 0aca 5328  E..<..@.@.T...S(
	0x0010:  0ae9 7d14 93ac 3aad db91 88eb 0000 0000  ..}...:.........
	0x0020:  a002 7210 e61d 0000 0204 05b4 0402 080a  ..r.............
	0x0030:  d4ed b80c 0000 0000 0103 0307            ............
10:35:43.260309 IP 10-202-83-40.kubernetes.default.svc.cluster.local.37834 > service-rev-proxy-578c69574-knmwz.15021: Flags [S], seq 3980103077, win 29200, options [mss 1460,sackOK,TS val 3572350931 ecr 0,nop,wscale 7], length 0
	0x0000:  4500 003c 0f62 4000 4006 456b 0aca 5328  E..<.b@.@.Ek..S(
	0x0010:  0ae9 7d14 93ca 3aad ed3b 8da5 0000 0000  ..}...:..;......
	0x0020:  a002 7210 e61d 0000 0204 05b4 0402 080a  ..r.............
	0x0030:  d4ed bfd3 0000 0000 0103 0307            ............
```

```
bash-5.0# wget http://127.0.0.1:15021/healthz/ready -O -
Connecting to 127.0.0.1:15021 (127.0.0.1:15021)
```

What happened?

[optional *Relevant Links*:]
>Any extra documentation required to understand the issue.

**Comment by antoniovicente** [comment]
All the packets in the TCP dump have the SYN flag set so these are retries while attempting to create a TCP connection.  Seems like the packets are being dropped and thus wget is not getting as far as creating a connection to the envoy.

Are there some iptable rules or firewall mechanism that is preventing the wget process from connecting to port 15021 ?

**Comment by shaneing** [comment]
> All the packets in the TCP dump have the SYN flag set so these are retries while attempting to create a TCP connection. Seems like the packets are being dropped and thus wget is not getting as far as creating a connection to the envoy.
> 
> Are there some iptable rules or firewall mechanism that is preventing the wget process from connecting to port 15021 ?

A service can work, but another can't. And, I ensure their iptables rules are the same. The rules as follow:

```
Chain PREROUTING (policy ACCEPT)
target     prot opt source               destination
ISTIO_INBOUND  tcp  --  anywhere             anywhere

Chain INPUT (policy ACCEPT)
target     prot opt source               destination

Chain OUTPUT (policy ACCEPT)
target     prot opt source               destination
ISTIO_OUTPUT  tcp  --  anywhere             anywhere

Chain POSTROUTING (policy ACCEPT)
target     prot opt source               destination

Chain ISTIO_INBOUND (1 references)
target     prot opt source               destination
RETURN     tcp  --  anywhere             anywhere             tcp dpt:15008
RETURN     tcp  --  anywhere             anywhere             tcp dpt:ssh
RETURN     tcp  --  anywhere             anywhere             tcp dpt:15090
RETURN     tcp  --  anywhere             anywhere             tcp dpt:15021
RETURN     tcp  --  anywhere             anywhere             tcp dpt:15020
ISTIO_IN_REDIRECT  tcp  --  anywhere             anywhere

Chain ISTIO_IN_REDIRECT (3 references)
target     prot opt source               destination
REDIRECT   tcp  --  anywhere             anywhere             redir ports 15006

Chain ISTIO_OUTPUT (1 references)
target     prot opt source               destination
RETURN     all  --  127.0.0.6            anywhere
ISTIO_IN_REDIRECT  all  --  anywhere            !localhost            owner UID match 1337
RETURN     all  --  anywhere             anywhere             ! owner UID match 1337
RETURN     all  --  anywhere             anywhere             owner UID match 1337
ISTIO_IN_REDIRECT  all  --  anywhere            !localhost            owner GID match 1337
RETURN     all  --  anywhere             anywhere             ! owner GID match 1337
RETURN     all  --  anywhere             anywhere             owner GID match 1337
RETURN     all  --  anywhere             localhost
ISTIO_REDIRECT  all  --  anywhere             anywhere

Chain ISTIO_REDIRECT (1 references)
target     prot opt source               destination
REDIRECT   tcp  --  anywhere             anywhere             redir ports 15001
```
