### ISSUE TITLE
Envoy resets the downstream sending only the response headers.

### ISSUE THREAD

**Issue by nikolovay** [envoyproxy/envoy#28286]
Hey all, first, just some quick background before getting into the issue we're experiencing. 

I have a fork of the Envoy that has some additional filters and some code changes. For a while, I observed some problems with my deployed Envoy. From time to time, it closes the client and server connection.

The following behavior has been observed since version 1.21 till 1.25. 1.26 is not tested yet.

My setup: 
I have an http2 client that establishes a connection to Envoy. It sends a lot of requests for a while. Envoy, on the other hand, talks with the upstream on http1. The server processes the requests and sends responses. Everything goes great, but at some point, when Envoy receives the response from the server, it reads it and sends FIN to the server. After that, it sends only response headers and RST to the http2 client. 

Pcap snippet: 
**Envoy RST:**
```
1558340	2023-06-15 15:08:07.997598	127.0.0.1	1080	127.0.0.1	60986	HEADERS[3435]: 200 OK, DATA[3435], DATA[3435], RST_STREAM[3435], HEADERS[3433]: 200 OK, DATA[3433], DATA[3433], RST_STREAM[3433], HEADERS[3453]: 200 OK, DATA[3453], DATA[3453], RST_STREAM[3453]
1558398	2023-06-15 15:08:08.000270	127.0.0.1	1080	127.0.0.1	60986	HEADERS[3423]: 200 OK, DATA[3423], DATA[3423], RST_STREAM[3423], HEADERS[3439]: 200 OK, DATA[3439], DATA[3439], RST_STREAM[3439], HEADERS[3441]: 200 OK, DATA[3441], DATA[3441], RST_STREAM[3441], HEADERS[3437]: 200 OK, DATA[3437], DATA[3437], RST_STREAM[3437], HEADERS[3431]: 200 OK, DATA[3431], DATA[3431], RST_STREAM[3431], HEADERS[3429]: 200 OK, DATA[3429], RST_STREAM[3429], HEADERS[3457]: 200 OK, RST_STREAM[3457], HEADERS[3455]: 200 OK, RST_STREAM[3455]
1558419	2023-06-15 15:08:08.001156	127.0.0.1	1080	127.0.0.1	60986	HEADERS[3425]: 200 OK, RST_STREAM[3425], HEADERS[3449]: 200 OK, RST_STREAM[3449], HEADERS[3451]: 200 OK, RST_STREAM[3451], HEADERS[3427]: 200 OK, RST_STREAM[3427]
1558434	2023-06-15 15:08:08.001739	127.0.0.1	1080	127.0.0.1	60986	HEADERS[3459]: 200 OK, RST_STREAM[3459]
```

RST with the ***HEADERS + DATA*** is ok because the client doesn’t send END_STREAM on time. But the one that has ***only HEADERS*** doesn’t look RFC compliant because all server responses have a body.

**A concrete example of the problem:**
```
Used filter: (tcp.port == 60986 && http2.streamid == 3457) || tcp.port == 46140
1558261	2023-06-15 15:08:07.991856	127.0.0.1	60986	127.0.0.1	1080	HEADERS[3423]: POST /pbm/sdk, HEADERS[3425]: POST /pbm/sdk, HEADERS[3427]: POST /pbm/sdk, HEADERS[3429]: POST /pbm/sdk, HEADERS[3431]: POST /pbm/sdk, HEADERS[3433]: POST /pbm/sdk, HEADERS[3435]: POST /pbm/sdk, HEADERS[3437]: POST /pbm/sdk, HEADERS[3439]: POST /pbm/sdk, HEADERS[3441]: POST /pbm/sdk, HEADERS[3443]: POST /pbm/sdk, HEADERS[3445]: POST /pbm/sdk, HEADERS[3447]: POST /pbm/sdk, HEADERS[3449]: POST /pbm/sdk, HEADERS[3451]: POST /pbm/sdk, HEADERS[3453]: POST /pbm/sdk, HEADERS[3455]: POST /pbm/sdk, HEADERS[3457]: POST /pbm/sdk, HEADERS[3459]: POST /pbm/sdk, HEADERS[3461]: POST /pbm/sdk, DATA[3423], DATA[3425], DATA[3427], DATA[3429], DATA[3431], DATA[3433], DATA[3435], DATA[3437], DATA[3439], DATA[3441], DATA[3443], DATA[3445], DATA[3447], DATA[3449], DATA[3451], DATA[3453], DATA[3455], DATA[3457]
1558297	2023-06-15 15:08:07.994360	127.0.0.1	46140	127.0.0.1	8190	46140 → 8190 [PSH, ACK] Seq=152058 Ack=67159 Win=65536 Len=489 TSval=3155302018 TSecr=3155301874 [TCP segment of a reassembled PDU]
1558312	2023-06-15 15:08:07.994682	127.0.0.1	46140	127.0.0.1	8190	POST /pbm/sdk HTTP/1.1 
1558328	2023-06-15 15:08:07.995857	127.0.0.1	8190	127.0.0.1	46140	8190 → 46140 [ACK] Seq=67159 Ack=155957 Win=65536 Len=0 TSval=3155302019 TSecr=3155302018
1558365	2023-06-15 15:08:07.999169	127.0.0.1	8190	127.0.0.1	46140	HTTP/1.1 200  
1558366	2023-06-15 15:08:07.999174	127.0.0.1	46140	127.0.0.1	8190	46140 → 8190 [ACK] Seq=155957 Ack=68881 Win=64256 Len=0 TSval=3155302022 TSecr=3155302022
1558382	2023-06-15 15:08:07.999737	127.0.0.1	46140	127.0.0.1	8190	46140 → 8190 [FIN, ACK] Seq=155957 Ack=68881 Win=65536 Len=0 TSval=3155302023 TSecr=3155302022
1558388	2023-06-15 15:08:07.999899	127.0.0.1	8190	127.0.0.1	46140	8190 → 46140 [FIN, ACK] Seq=68881 Ack=155958 Win=65536 Len=0 TSval=3155302023 TSecr=3155302023
1558389	2023-06-15 15:08:07.999905	127.0.0.1	46140	127.0.0.1	8190	46140 → 8190 [ACK] Seq=155958 Ack=68882 Win=65536 Len=0 TSval=3155302023 TSecr=3155302023
1558398	2023-06-15 15:08:08.000270	127.0.0.1	1080	127.0.0.1	60986	HEADERS[3423]: 200 OK, DATA[3423], DATA[3423], RST_STREAM[3423], HEADERS[3439]: 200 OK, DATA[3439], DATA[3439], RST_STREAM[3439], HEADERS[3441]: 200 OK, DATA[3441], DATA[3441], RST_STREAM[3441], HEADERS[3437]: 200 OK, DATA[3437], DATA[3437], RST_STREAM[3437], HEADERS[3431]: 200 OK, DATA[3431], DATA[3431], RST_STREAM[3431], HEADERS[3429]: 200 OK, DATA[3429], RST_STREAM[3429], HEADERS[3457]: 200 OK, RST_STREAM[3457], HEADERS[3455]: 200 OK, RST_STREAM[3455]
1558435	2023-06-15 15:08:08.001842	127.0.0.1	60986	127.0.0.1	1080	WINDOW_UPDATE[0], HEADERS[3463]: POST /pbm/sdk, DATA[3461], DATA[3463], DATA[3463], DATA[3423], DATA[3425], DATA[3427], DATA[3429], DATA[3431], DATA[3437], DATA[3439], DATA[3441], DATA[3443], DATA[3449], DATA[3451], DATA[3455], DATA[3457], DATA[3459], DATA[3461]
```

```
%START_TIME% %REQ(:METHOD)% %REQ(X-ENVOY-ORIGINAL-PATH?:PATH)% %PROTOCOL% %RESPONSE_CODE% %RESPONSE_CODE_DETAILS% %RESPONSE_FLAGS% %BYTES_RECEIVED% %BYTES_SENT% %DURATION% %RESP(X-ENVOY-UPSTREAM-SERVICE-TIME)% %RESPONSE_TX_DURATION% %DOWNSTREAM_REMOTE_ADDRESS% %DOWNSTREAM_TLS_VERSION% %DOWNSTREAM_LOCAL_ADDRESS% %UPSTREAM_LOCAL_ADDRESS%

2023-06-15T15:08:07.992Z POST /pbm/sdk HTTP/2 200 via_upstream - 3410 1512 6 - 0 127.0.0.1:60986 - 127.0.0.1:1080 127.0.0.1:46140 - 127.0.0.1:8190 
```
**Note: no response flags are set**

I validated that the request and response are correct. Actually, the same request and complete response passed successfully half an hour later. 
Also, I want to clarify that the client doesn’t send END_STREAM flag at the first data package(number 1558261). It sends it after the RST from the Envoy (package: 1558398). I’m not sure if it matters. 

Also, at this point, I can't reproduce the issue consistently, and it's only observed occasionally in our internal tests.

Could you please help me with the issue? I looked at the Envoy source, but at this point, I am still trying to understand why it acts this way and what could cause this behavior. The issue is not reproduced with trace logging(client and/or Envoy). Also, it is not reproduced with specific Envoy loggers(connection and/or http) set at trace or debug level. It looks like some race, but I’m not familiar with this part of the Envoy source. Do you have any idea what could be the reason for this behavior?

Unfortunately, I can't share the code of the client or server. The problem can be something related to them. This is why I use the "other" category instead of the "bug" one.

**Comment by kyessenov** [comment]
cc @yanavlasov

**Comment by nikolovay** [comment]
Hi all, were you able to look at my question?
