### ISSUE TITLE
Http connection reset, but the TCP is succeed when using Valgrind in Istio

### ISSUE THREAD

**Issue by HWPeiyao** [envoyproxy/envoy#5113]
Http connection reset, but the TCP is succeed when using Valgrind in Istio

### *Description*:
I’m trying to use the tool callgrind in Valgrind to get the real-time call graph of envoy, which is running under the Istio proxy. I revised the envoy start code from _./envoy + parameters_ to _valgrind --tool=callgrind ./envoy + parameters_. But when I use curl to visit nginx http server behind envoy, the HTTP connection is reset so that I could not visit the webpage:

>$ curl 172.16.0.33:80
curl: (7) Failed connect to 172.16.0.33:80; Connection refused

### *Logs*:

>[2018-11-22 01:44:29.551][13][info][main] external/envoy/source/server/server.cc:203]   transport_sockets.downstream: alts,envoy.transport_sockets.capture,raw_buffer,tls
[2018-11-22 01:44:29.552][13][info][main] external/envoy/source/server/server.cc:206]   transport_sockets.upstream: alts,envoy.transport_sockets.capture,raw_buffer,tls
[2018-11-22 01:44:29.944][13][info][config] external/envoy/source/server/configuration_impl.cc:50] loading 0 static secret(s)
[2018-11-22 01:44:30.325][13][warning][upstream] external/envoy/source/common/config/grpc_mux_impl.cc:240] gRPC config stream closed: 14, no healthy upstream
[2018-11-22 01:44:30.334][13][warning][upstream] external/envoy/source/common/config/grpc_mux_impl.cc:41] Unable to establish new stream
[2018-11-22 01:44:30.335][13][info][config] external/envoy/source/server/configuration_impl.cc:60] loading 0 listener(s)
[2018-11-22 01:44:30.336][13][info][config] external/envoy/source/server/configuration_impl.cc:94] loading tracing configuration
[2018-11-22 01:44:30.337][13][info][config] external/envoy/source/server/configuration_impl.cc:103]   loading tracing driver: envoy.zipkin
[2018-11-22 01:44:30.445][13][info][config] external/envoy/source/server/configuration_impl.cc:116] loading stats sink configuration
[2018-11-22 01:44:30.516][13][info][main] external/envoy/source/server/server.cc:418] starting main dispatch loop
[2018-11-22 01:44:30.615][13][info][upstream] external/envoy/source/common/upstream/cluster_manager_impl.cc:130] cm init: initializing cds
**[2018-11-22 01:44:41.793][13][warning][upstream] external/envoy/source/common/config/grpc_mux_impl.cc:240] gRPC config stream closed: 14, upstream connect error or disconnect/reset before headers
[2018-11-22 01:44:53.281][13][warning][upstream] external/envoy/source/common/config/grpc_mux_impl.cc:240] gRPC config stream closed: 14, upstream connect error or disconnect/reset before headers**

In the proxy container the tcpdump shows that the stream is reset, return the reset flag:

>$ tcpdump -p tcp
tcpdump: verbose output suppressed, use -v or -vv for full protocol decode
listening on eth0, link-type EN10MB (Ethernet), capture size 262144 bytes
03:08:14.097846 IP 172.16.0.17.44844 > nginx-v1-64dc9b7dc5-9tj8w.http: Flags [S], seq 100742906, win 29200, options [mss 1460,sackOK,TS val 3970652136 ecr 0,nop,wscale 7], length 0
03:08:14.097898 IP nginx-v1-64dc9b7dc5-9tj8w.http > 172.16.0.17.44844: Flags [R.], seq 0, ack 100742907, win 0, length 0
^C
2 packets captured
2 packets received by filter
0 packets dropped by kernel

When I change the backend server to iperf3 to build a **tcp connection**. The connection is successful:

>$ iperf3 -c 172.16.0.35 -p 5201
Connecting to host 172.16.0.35, port 5201
 [  4] local 172.16.0.17 port 55066 connected to 172.16.0.35 port 5201
[ ID] Interval           Transfer     Bandwidth       Retr  Cwnd
[  4]   0.00-1.00   sec  1.94 GBytes  16.7 Gbits/sec    0   1.91 MBytes
[  4]   1.00-2.00   sec  1.48 GBytes  12.7 Gbits/sec    0   2.00 Mbytes

And I can get the normal tcp stream in istio-proxy with tcpdump:

>03:16:08.673976 IP 172.16.0.17.55064 > iperf.5201: Flags [S], seq 1098387993, win 28200, options [mss 1410,sackOK,TS val 3971126712 ecr 0,nop,wscale 7], length 0
03:16:08.674029 IP iperf.5201 > 172.16.0.17.55064: Flags [S.], seq 3298436655, ack 1098387994, win 27800, options [mss 1402,sackOK,TS val 3971126713 ecr 3971126712,nop,wscale 7], length 0
03:16:08.674056 IP 172.16.0.17.55064 > iperf.5201: Flags [.], ack 1, win 221, options [nop,nop,TS val 3971126713 ecr 3971126713], length 0
03:16:08.674645 IP 172.16.0.17.55064 > iperf.5201: Flags [P.], seq 1:38, ack 1, win 221, options [nop,nop,TS val 3971126713 ecr 3971126713], length 37
03:16:08.676844 IP iperf.5201 > 172.16.0.17.55064: Flags [.], ack 38, win 218, options [nop,nop,TS val 3971126715 ecr 3971126713], length 0

The pods do not restart in both two situations.
It seems like that the L4 TCP connection is successful but the L7 HTTP connection is not working.
Anyone can figure out what happens?
Or can you recommand other tools to get the call graph?
Thank you.
