### ISSUE TITLE
Question: Envoy connection close for HTTP 1.0

### ISSUE THREAD

**Issue by asaha123** [envoyproxy/envoy#19870]
*Title*: *Connection closing for http 1.0 connection*

*Description*:

I am chasing a bit of a curiosity here, so I am hoping you will indulge me.

I am using Apache Bench, `ab` which makes HTTP/1.0 requests and by default has no `keep-alive` enabled.

I have envoy configured to listen on 10000 and forwarding traffic to an upstream HTTP server started via `python3 -m http.server`. (see [envoy.yaml](https://gist.github.com/asaha123/fcfb34a3cc9f00a9f6581f310149c937))

```
$ ab -v 4 -n 1 -c 1 http://localhost:10000/
This is ApacheBench, Version 2.3 <$Revision: 1879490 $>
Copyright 1996 Adam Twiss, Zeus Technology Ltd, http://www.zeustech.net/
Licensed to The Apache Software Foundation, http://www.apache.org/

Benchmarking localhost (be patient)...INFO: GET header == 
---
GET / HTTP/1.0
Host: localhost:10000
User-Agent: ApacheBench/2.3
Accept: */*


---
LOG: header received:
HTTP/1.0 200 OK
server: envoy
date: Tue, 08 Feb 2022 06:58:29 GMT
content-type: text/html; charset=utf-8
content-length: 1283
x-envoy-upstream-service-time: 1
connection: close


LOG: Response code = 200
..done
```

The result is:

```
Connection Times (ms)
              min  mean[+/-sd] median   max
Connect:        0    0   0.0      0       0
Processing:  1004 1004   0.0   1004    1004
Waiting:        1    1   0.0      1       1
Total:       1004 1004   0.0   1004    1004
```

What I am chasing here is the ~1s Processing time.

I can see that after `LOG: Response code = 200`, there is a wait of ~900 millisecond second before `ab` prints `..done`. And I can see that it is how long envoy waits before it terminates the connection:

```
07:04:06.523109 IP 127.0.0.1.10000 > 127.0.0.1.46472: Flags [F.], seq 1470, ack 84, win 512, options [nop,nop,TS val 1409532084 ecr 1409531083], length 0
07:04:06.523213 IP 127.0.0.1.46472 > 127.0.0.1.10000: Flags [F.], seq 84, ack 1471, win 512, options [nop,nop,TS val 1409532084 ecr 1409532084], length 0
07:04:06.523221 IP 127.0.0.1.10000 > 127.0.0.1.46472: Flags [.], ack 85, win 512, options [nop,nop,TS val 1409532084 ecr 1409532084], length 0
```

Reference:

```
10000 -> my envoy listener port
46472 -> my `ab` process ephemeral port
```

Question: **I am curious as to where this timeout is configured in envoy?**

I should note that, when I run `ab` with `keepalive` enabled, I can see that `ab` itself terminates the connection. So it's likely that `ab` should be closing the connection in the former case as well, but as I said I am chasing my curiosity here.

**Comment by jeremybaumont** [comment]
That is the delay close timeout of the [http connection manager](https://www.envoyproxy.io/docs/envoy/latest/api-v3/extensions/filters/network/http_connection_manager/v3/http_connection_manager.proto.html?highlight=delayed_close_timeout). If you enable the debug log in envoy, you will see a line after the processing of the request that is like the following:

```
[2022-02-08 09:46:44.276][33][debug][connection] [source/common/network/connection_impl_base.cc:47] [C155] setting delayed close timer with timeout 1000 ms
```

If you change the http connection manager to something like the following, you will see your processing time reducing to a couple of ms:

```
- name: envoy.filters.network.http_connection_manager
...
          delayed_close_timeout: 
            nanos: 100
```

The difference observed when you use KeepAlive is that -k sends the KeepAlive header, which asks envoy to not shut down the connection after the request is done.

**Comment by htuch** [comment]
CC @alyssawilk @yanavlasov @mattklein123

**Comment by alyssawilk** [comment]
see also https://github.com/envoyproxy/envoy/issues/19821 and https://github.com/envoyproxy/envoy/pull/19863 :-)

**Comment by asaha123** [comment]
Thanks @jeremybaumont @alyssawilk ! Appreciate your quick reply.
