### ISSUE TITLE
Envoy "Connection: close" causes 1s rq_time overhead

### ISSUE THREAD

**Issue by fkowal** [envoyproxy/envoy#5788]
Given the below configuration:

Request with __Connection: close__, causes envoy to delays the sending the tcp (FIN) / closing the socket by 1s.

Envoy sends the response data, rightaway (no delay visible in tcpdump / wireshark), the FIN / closing of the connection is the issue.
```bash
time fortio curl -loglevel=debug -keepalive=false localhost:8080/
```

Request without 'Connection: close', works as expected
```bash
time fortio curl -loglevel=debug localhost:8080/
```

```yaml
---
node:
  locality:
    zone: default-zone

static_resources:
  listeners:
  - name: default_listener
    address:
      socket_address:
        address: 0.0.0.0
        port_value: 8080
    filter_chains:
    - filters:
      - name: envoy.http_connection_manager
        config:
          stat_prefix: ingress_proxy
          access_log:
            name: envoy.file_access_log
            config:
              path: "/dev/stdout"
              format: >
                [%START_TIME%] %PROTOCOL% %REQ(:METHOD)% %REQ(:authority)% %REQ(:PATH)% %RESPONSE_CODE% %RESPONSE_FLAGS%
                %BYTES_RECEIVED%b %BYTES_SENT%b %DURATION%ms "%DOWNSTREAM_REMOTE_ADDRESS%" -> "%UPSTREAM_HOST%"
          route_config:
            name: "ingress_routes"
            virtual_hosts:
              - name: "local_service"
                domains:
                  - "*"
                routes:
                  - match:
                      prefix: "/"
                    route:
                      cluster: "example"
          http_filters:
            - name: envoy.router
          http_protocol_options:
            allow_absolute_url: true

  clusters:
  - name: example
    type: STRICT_DNS
    hosts:
    - socket_address:
        address: 127.0.0.1
        port_value: 9091
    connect_timeout:
      seconds: 1

admin:
  access_log_path: "/dev/null"
  address:
    socket_address:
      address: 0.0.0.0
      port_value: 9091
```

This looks similar to #234, we've noticed unhealthy instances in varnish, when probes had .timeout < 1s.

**Comment by fkowal** [comment]
```
tcpdump -nni lo0 -s 0 -A tcp portrange 8080
tcpdump: verbose output suppressed, use -v or -vv for full protocol decode
listening on lo0, link-type NULL (BSD loopback), capture size 262144 bytes
13:15:10.238945 IP6 ::1.65046 > ::1.8080: Flags [S], seq 1696331147, win 65535, options [mss 16324,nop,wscale 6,nop,nop,TS val 803548502 ecr 0,sackOK,eol], length 0
`..0.,.@....................................e............4....?........
/.-V........
13:15:10.239025 IP6 ::1.8080 > ::1.65046: Flags [S.], seq 2050231525, ack 1696331148, win 65535, options [mss 16324,nop,wscale 6,nop,nop,TS val 803548502 ecr 803548502,sackOK,eol], length 0
`....,.@....................................z4..e........4....?........
/.-V/.-V....
13:15:10.239037 IP6 ::1.65046 > ::1.8080: Flags [.], ack 1, win 6371, options [nop,nop,TS val 803548502 ecr 803548502], length 0
`..0. .@....................................e...z4.......(.....
/.-V/.-V
13:15:10.239045 IP6 ::1.8080 > ::1.65046: Flags [.], ack 1, win 6371, options [nop,nop,TS val 803548502 ecr 803548502], length 0
`.... .@....................................z4..e........(.....
/.-V/.-V
13:15:10.239089 IP6 ::1.65046 > ::1.8080: Flags [P.], seq 1:97, ack 1, win 6371, options [nop,nop,TS val 803548502 ecr 803548502], length 96: HTTP: GET / HTTP/1.1
`..0...@....................................e...z4.............
/.-V/.-VGET / HTTP/1.1
Host: localhost:8080
Connection: close
User-Agent: fortio.org/fortio-1.3.0


13:15:10.239101 IP6 ::1.8080 > ::1.65046: Flags [.], ack 97, win 6370, options [nop,nop,TS val 803548502 ecr 803548502], length 0
`.... .@....................................z4..e........(.....
/.-V/.-V
13:15:10.247298 IP6 ::1.8080 > ::1.65046: Flags [P.], seq 1:4807, ack 97, win 6370, options [nop,nop,TS val 803548510 ecr 803548502], length 4806: HTTP: HTTP/1.1 200 OK
`......@....................................z4..e..............
/.-^/.-VHTTP/1.1 200 OK
content-type: text/html; charset=UTF-8
cache-control: no-cache, max-age=0
x-content-type-options: nosniff
date: Thu, 31 Jan 2019 12:15:10 GMT
server: envoy
x-envoy-upstream-service-time: 0
connection: close
transfer-encoding: chunked

11b4
<head>
  <title>Envoy Admin</title> etc
</body>

0


13:15:10.247329 IP6 ::1.65046 > ::1.8080: Flags [.], ack 4807, win 6296, options [nop,nop,TS val 803548510 ecr 803548510], length 0
`..0. .@....................................e...z4.......(.....
/.-^/.-^
13:15:11.250726 IP6 ::1.8080 > ::1.65046: Flags [.], ack 97, win 6370, length 0
`......@....................................z4..e...P.......
13:15:11.250767 IP6 ::1.65046 > ::1.8080: Flags [.], ack 4807, win 6296, options [nop,nop,TS val 803549510 ecr 803548510], length 0
`..0. .@....................................e...z4.......(.....
/.1F/.-^
13:15:11.252739 IP6 ::1.8080 > ::1.65046: Flags [F.], seq 4807, ack 97, win 6370, options [nop,nop,TS val 803549512 ecr 803549510], length 0
`.... .@....................................z4..e........(.....
/.1H/.1F
13:15:11.252769 IP6 ::1.65046 > ::1.8080: Flags [.], ack 4808, win 6296, options [nop,nop,TS val 803549512 ecr 803549512], length 0
`..0. .@....................................e...z4.......(.....
/.1H/.1H
13:15:11.252815 IP6 ::1.65046 > ::1.8080: Flags [F.], seq 97, ack 4808, win 6296, options [nop,nop,TS val 803549512 ecr 803549512], length 0
`..0. .@....................................e...z4.......(.....
/.1H/.1H
13:15:11.252866 IP6 ::1.8080 > ::1.65046: Flags [.], ack 98, win 6370, options [nop,nop,TS val 803549512 ecr 803549512], length 0
`.... .@....................................z4..e........(.....
/.1H/.1H
```

Here is the tcpdump

**Comment by alyssawilk** [comment]
If it's a close due to early response, it's likely ConnectionCloseType::FlushWriteAndDelay which was introduced to address the race described in #2929

If that's the problem you could fix by adjusting  delayed_close_timeout in your HCM config but depending on how your client handles resets you might reintroduce the race described in that issue

cc @AndresGuedez

**Comment by fkowal** [comment]
Changing the __delayed_close_timeout__ did helped lowering the delay with the responses.

These metrics keep increasing, which I belive is an indication that varnish is not issuing a FIN after receiving the response.
*http.ingress_http.downstream_cx_delayed_close_timeout* and *http.ingress_http.downstream_cx_destroy_local*

Thank you @alyssawilk
