### ISSUE TITLE
Envoy appears to holds connection for 1s when using http 1.0

### ISSUE THREAD

**Issue by howardjohn** [envoyproxy/envoy#6223]
*Title*: Envoy holds connection for 1s when using http 1.0 proxy

*Description*:
I have an Istio setup, with Envoy set up to [accept_http_10](https://www.envoyproxy.io/docs/envoy/latest/api-v2/api/v2/core/protocol.proto#core-http1protocoloptions) traffic. When I make a http 1.1 call, (client -> client envoy -> destination envoy -> destination), everything works fine. When I make a http 1.0 call, there is a 1s delay before the connection is closed. I believe this is happening between the client and client's envoy.

Here are some TCP Dumps from the client:

`fortio curl -http1.0`, showing the 1s delay
```
19:33:27.944004 IP 10.35.248.249.8080 > 10.32.2.82.59364: Flags [S.], seq 3258149487, ack 3450358404, win 43690, options [mss 65495,sackOK,TS val 3753766754 ecr 356620891,nop,wscale 7], length 0
19:33:27.944481 IP 10.35.248.249.8080 > 10.32.2.82.59364: Flags [.], ack 81, win 342, options [nop,nop,TS val 3753766754 ecr 356620891], length 0
19:33:27.948279 IP 10.35.248.249.8080 > 10.32.2.82.59364: Flags [P.], seq 1:144, ack 81, win 342, options [nop,nop,TS val 3753766758 ecr 356620891], length 143: HTTP: HTTP/1.0 200 OK
19:33:28.947563 IP 10.35.248.249.8080 > 10.32.2.82.59364: Flags [F.], seq 144, ack 81, win 342, options [nop,nop,TS val 3753767757 ecr 356620895], length 0
19:33:28.947736 IP 10.35.248.249.8080 > 10.32.2.82.59364: Flags [.], ack 82, win 342, options [nop,nop,TS val 3753767757 ecr 356621894], length 0
```

`curl --http1.0`, no delay
```
19:34:16.947898 IP 10.35.248.249.8080 > 10.32.2.82.59508: Flags [S.], seq 4213325499, ack 3301568370, win 43690, options [mss 65495,sackOK,TS val 3753815754 ecr 356669891,nop,wscale 7], length 0
19:34:16.948016 IP 10.35.248.249.8080 > 10.32.2.82.59508: Flags [.], ack 83, win 342, options [nop,nop,TS val 3753815754 ecr 356669891], length 0
19:34:16.952632 IP 10.35.248.249.8080 > 10.32.2.82.59508: Flags [P.], seq 1:144, ack 83, win 342, options [nop,nop,TS val 3753815758 ecr 356669891], length 143: HTTP: HTTP/1.0 200 OK
19:34:16.952865 IP 10.35.248.249.8080 > 10.32.2.82.59508: Flags [F.], seq 144, ack 84, win 342, options [nop,nop,TS val 3753815759 ecr 356669896], length 0
```

I believe curl doesn't have this issue because:
>(it doesn't affect curl because curl parses the content-length which is not required for 1.0 and closes the connection client side when it sees it has all the data, but again that's not how a normal/old style 1.0 client would behave, as fortio demonstrates)

More discussion on this pr https://github.com/istio/tools/pull/50

Is this a bug or intended, or could anyone explain what is happening here?

I can try to reproduce this without Istio, but I am fairly confident that Istio is not relevant here. Let me know if there is any other info needed.

**Comment by mattklein123** [comment]
See "delayed_close_timeout" https://www.envoyproxy.io/docs/envoy/latest/api-v2/config/filter/network/http_connection_manager/v2/http_connection_manager.proto

**Comment by howardjohn** [comment]
Thanks for the quick response!

**Comment by ldemailly** [comment]
can the setting be applied only for http1.0 ? (or can http1.0 mode of envoy just close the writing part of the socket immediately after write like the standard implies)

**Comment by ldemailly** [comment]
ping ^

**Comment by ramaraochavali** [comment]
@alyssawilk Is it possible to disable delayed close timeout for http 1.0 completely via flag in HCM? or at-least give an option of separate delayed close timeout for 1.0? We are also running in to above issue (and we do not have control over client) and Envoy does not close the http 1.0 connection before delayed close timeout adding latency overhead to http 1.0 clients?

**Comment by alyssawilk** [comment]
can you give me  a trace log for #19863  not helping?  I'd like to understand what's going on there before we add another knob.

**Comment by ramaraochavali** [comment]
@alyssawilk Sorry. It seems #19863 is actually helping - I have tested with wrong sha. Sorry for the confusion.
