### ISSUE TITLE
Envoy option "upstream_bind_config" in cluster configuration seems not working for UDP protocol .

### ISSUE THREAD

**Issue by sochackid** [envoyproxy/envoy#32499]
*Title*: *Envoy option "upstream_bind_config" in cluster configuration seems not working for UDP protocol .*

*Description*:
Hi Envoy Team,

I would ask you why "upstream_bind_config" in the cluster configuration is working for TCP traffic but not for UDP.

My goal is to set up or change the source IP in the upstream (to backend) connections. I want to use IP from the Envoy host (linux).

I found and decided to use " upstream_bind_config" in the cluster configuration.

For the TCP connection, the below configuration is working well (is using the correct source IP):
```
resources:
- "@type": type.googleapis.com/envoy.config.cluster.v3.Cluster
  name: CLUSTERNAME
  ...
  type: EDS
  ...
  upstream_bind_config:
    source_address: { address: 10.10.10.3, port_value: 0}
 ...
```
but unfortunately for UDP traffic, the below configuration is not working (use wrong, not set up the source IP):
```
resources:
- "@type": type.googleapis.com/envoy.config.cluster.v3.Cluster
  name: CLUSTERNAME
  ...
  type: EDS
  ...
  upstream_bind_config:
    source_address: { protocol: UDP, address: 10.10.10.3, port_value: 0}
 ...
```

Please let me know, reason why  "upstream_bind_config" is not working for UDP. How should I configure Envoy to achieve my goal? Change the source IP in the upstream connections.

**Comment by lizan** [comment]
cc @danzh2010

**Comment by danzh2010** [comment]
Hi there, thanks for reaching to us!

How did you observe the wrong source IP? Did you use tcpdump and see upstream traffic goes through a different network interface or from Envoy log? 

There is nothing obviously wrong at first glance. But I can take a deeper look later. Did you see any error in the Envoy log? Could you remove `protocol: UDP` from your config and see if that works?

**Comment by sochackid** [comment]
Hi @danzh2010,

Thank you for your response.

The issue had been observed via tcpdump.

In my environment, I set up net2 (the downstream interface, connected to the client) and net1 (the upstream interface).

For the below client nc query:

```
CLIENT_HOST:/# nc -u -v 10.204.1.101 5015
Connection to 10.204.1.101 5015 port [udp/*] succeeded!
```

I have tcpdump output on the Envoy host:
```
ENVOY_HOST# tcpdump -i any -n udp and not port bootps
tcpdump: data link type LINUX_SLL2
dropped privs to tcpdump
tcpdump: verbose output suppressed, use -v[v]... for full protocol decode
listening on any, link-type LINUX_SLL2 (Linux cooked v2), snapshot length 262144 bytes
01:34:25.561998 net2  In  IP 10.204.1.100.61072 > 10.204.1.101.5015: UDP, length 1 ==> where 10.204.1.100 is the client IP and 10.204.1.101 is the Envoy listener IP.
01:34:25.562129 net2  In  IP 10.204.1.100.61072 > 10.204.1.101.5015: UDP, length 1
01:34:25.563979 net1  Out IP 172.168.1.13.59373 > 172.168.1.15.5015: UDP, length 1 ==> upstream connections, where 172.168.1.13 is the IP on the net1 Envoy host and 172.168.1.15 is the backend. 
01:34:26.562305 net2  In  IP 10.204.1.100.61072 > 10.204.1.101.5015: UDP, length 1
01:34:26.562596 net1  Out IP 172.168.1.13.59373 > 172.168.1.15.5015: UDP, length 1
01:34:27.562575 net2  In  IP 10.204.1.100.61072 > 10.204.1.101.5015: UDP, length 1
01:34:27.562924 net1  Out IP 172.168.1.13.59373 > 172.168.1.15.5015: UDP, length 1
01:34:28.563056 net2  In  IP 10.204.1.100.61072 > 10.204.1.101.5015: UDP, length 1
01:34:28.563311 net1  Out IP 172.168.1.13.59373 > 172.168.1.15.5015: UDP, length 1
```

The configuration for the net1 interface is:
```
ENVOY_HOST# ip a s dev net1
4: net1@if3: <BROADCAST,MULTICAST,UP,LOWER_UP> mtu 1500 qdisc noqueue state UP group default
    link/ether be:3a:d4:67:6b:de brd ff:ff:ff:ff:ff:ff link-netnsid 0
    inet 172.168.1.13/24 brd 172.168.1.255 scope global net1
       valid_lft forever preferred_lft forever
    inet 10.10.10.3/24 scope global net1
       valid_lft forever preferred_lft forever
    inet6 fe80::bc3a:d4ff:fe67:6bde/64 scope link
       valid_lft forever preferred_lft forever
```

My goal is to change the source IP in the upstream traffic from 172.168.1.13 to 10.10.10.3. I used upstream_bind_config, and for TCP, it is working well, but for UDP, it is not.

For UDP I tried:
```
resources:
- "@type": type.googleapis.com/envoy.config.cluster.v3.Cluster
  name: CLUSTERNAME
  ...
  type: EDS
  ...
  upstream_bind_config:
    source_address: { protocol: UDP, address: 10.10.10.3, port_value: 0}
 ...
```
and
```
resources:
- "@type": type.googleapis.com/envoy.config.cluster.v3.Cluster
  name: CLUSTERNAME
  ...
  type: EDS
  ...
  upstream_bind_config:
    source_address: {  address: 10.10.10.3, port_value: 0}
 ...
```
with the same wrong result. IP 172.168.1.13 from the net1 interface is still used for upstream traffic.

Are you able to reproduce the issue in your lab environment? or explain why this is behaviour.

Thank you in advance.

**Comment by sochackid** [comment]
Hi @danzh2010,

Did you have a chance to check on the issue?

regards

**Comment by sochackid** [comment]
Hi @danzh2010,
Any new in this topic?
regards

**Comment by sochackid** [comment]
Hi @danzh2010,

Thank you for testing and response.

But Like I have mentioned in previous comment, it is not issue with TCP(or http) but with UDP traffic.

Can you perform test for UDP service?

Please let me know if you need additional details.

regards

**Comment by danzh2010** [comment]
> Hi @danzh2010,
> 
> Thank you for testing and response.
> 
> But Like I have mentioned in previous comment, it is not issue with TCP(or http) but with UDP traffic.
> 
> Can you perform test for UDP service?
> 
> Please let me know if you need additional details.
> 
> regards

The test was changed to upstream with HTTP/3.

**Comment by danzh2010** [comment]
Did you use a customized self address selector?

**Comment by sochackid** [comment]
Hi @danzh2010,

Please be informed that:
1.  In my setup, I used a pure UDP service, not HTTP/3 or another protocol that is based on UDP.
2. For the upstream flow I used:
```
 "@type": type.googleapis.com/envoy.config.cluster.v3.Cluster
```
Could you perform test for "pure" UDP service and  "@type": type.googleapis.com/envoy.config.cluster.v3.Cluster?
Thank you in advance.

I have not used customized self address selector. But if it is possible to change the upstream direction of the SRC IP with this option and the SRC IP will be from the envoy host (not from the downstream client), please share information on how I can use this one.

ps: I have attached an example flow diagram of what I want to achieve.
 
![envoy_case](https://github.com/envoyproxy/envoy/assets/98892130/58c6b19e-685b-43e4-bf90-6e2d856bdbfe)

**Comment by sochackid** [comment]
Hi @danzh2010,

Have you had occasion to check my requirements?

regards

**Comment by danzh2010** [comment]
Hi there, from your last comment this seems to be an issue with UDP proxy which I'm not the code owner nor familiar with. I would suggest ask in the envoy-dev channel to see if anyone can help in a better way.

**Comment by sochackid** [comment]
Hi @danzh2010,

Thank you for support. I had left note on the Envoy Slack channel but unfortunately without positive response. Are you able resigned this issue to the developer who is aware about UDP proxy? 

Thank you in advance.
