### ISSUE TITLE
Connection reset generated by Envoy

### ISSUE THREAD

**Issue by prateek0394** [envoyproxy/envoy#19664]
I am using **EnvoyProxy version : 1.15.2**. My usecase is a reverse proxy solution meant for multi-tenant system. 

As part of my connection manager configuration : 

```
- name: envoy.http_connection_manager
   config:
     stat_prefix: ingress_http
     codec_type: AUTO
     common_http_protocol_options:
       max_connection_duration: 120s
```

Intermittently, my customers are seeing "Connection reset by Peer" exception in their code. I took TCPDump for one such customer, and saw following behavior : 

```
19:15:19.286535 IP (tos 0x0, ttl 255, id 57091, offset 0, flags [DF], proto TCP (6), length 60)
    10.18.191.67.44332 > 10.80.65.146.8080: Flags [S], cksum 0x1566 (incorrect -> 0xfb6a), seq 849832810, win 62727, options [mss 8961,sackOK,TS val 3662798824 ecr 0,nop,wscale 7], length 0

19:15:19.288045 IP (tos 0x0, ttl 252, id 0, offset 0, flags [DF], proto TCP (6), length 60)
    10.80.65.146.8080 > 10.18.191.67.44332: Flags [S.], cksum 0x8538 (correct), seq 2913470994, ack 849832811, win 26847, options [mss 1460,sackOK,TS val 297489952 ecr 3662798824,nop,wscale 8], length 0

19:15:19.288053 IP (tos 0x0, ttl 255, id 57092, offset 0, flags [DF], proto TCP (6), length 52)
    10.18.191.67.44332 > 10.80.65.146.8080: Flags [.], cksum 0x155e (incorrect -> 0x1af8), ack 1, win 491, options [nop,nop,TS val 3662798826 ecr 297489952], length 0

19:15:19.288211 IP (tos 0x0, ttl 255, id 57093, offset 0, flags [DF], proto TCP (6), length 672)
    10.18.191.67.44332 > 10.80.65.146.8080: Flags [P.], cksum 0x17ca (incorrect -> 0x93a8), seq 1:621, ack 1, win 491, options [nop,nop,TS val 3662798826 ecr 297489952], length 620: HTTP, length: 620

19:15:19.289166 IP (tos 0x0, ttl 252, id 16385, offset 0, flags [DF], proto TCP (6), length 52)
    10.80.65.146.8080 > 10.18.191.67.44332: Flags [.], cksum 0x1a09 (correct), ack 621, win 110, options [nop,nop,TS val 297489952 ecr 3662798826], length 0

19:15:19.296689 IP (tos 0x0, ttl 252, id 16386, offset 0, flags [DF], proto TCP (6), length 505)
    10.80.65.146.8080 > 10.18.191.67.44332: Flags [P.], cksum 0xdb48 (correct), seq 1:454, ack 621, win 110, options [nop,nop,TS val 297489953 ecr 3662798826], length 453: HTTP, length: 453

19:15:19.296699 IP (tos 0x0, ttl 255, id 57094, offset 0, flags [DF], proto TCP (6), length 52)
    10.18.191.67.44332 > 10.80.65.146.8080: Flags [.], cksum 0x155e (incorrect -> 0x16c1), ack 454, win 488, options [nop,nop,TS val 3662798834 ecr 297489953], length 0

19:15:32.166437 IP (tos 0x0, ttl 255, id 57095, offset 0, flags [DF], proto TCP (6), length 723)
    10.18.191.67.44332 > 10.80.65.146.8080: Flags [P.], cksum 0x17fd (incorrect -> 0x2472), seq 621:1292, ack 454, win 488, options [nop,nop,TS val 3662811704 ecr 297489953], length 671: HTTP, length: 671

19:15:32.191067 IP (tos 0x0, ttl 252, id 16387, offset 0, flags [DF], proto TCP (6), length 779)
    10.80.65.146.8080 > 10.18.191.67.44332: Flags [P.], cksum 0xe552 (correct), seq 454:1181, ack 1292, win 115, options [nop,nop,TS val 297491242 ecr 3662811704], length 727: HTTP, length: 727

19:15:32.191079 IP (tos 0x0, ttl 255, id 57096, offset 0, flags [DF], proto TCP (6), length 52)
    10.18.191.67.44332 > 10.80.65.146.8080: Flags [.], cksum 0x155e (incorrect -> 0xd9e7), ack 1181, win 483, options [nop,nop,TS val 3662811729 ecr 297491242], length 0

19:16:17.470597 IP (tos 0x0, ttl 255, id 57097, offset 0, flags [DF], proto TCP (6), length 723)
    10.18.191.67.44332 > 10.80.65.146.8080: Flags [P.], cksum 0x17fd (incorrect -> 0x3f3d), seq 1292:1963, ack 1181, win 483, options [nop,nop,TS val 3662857008 ecr 297491242], length 671: HTTP, length: 671

19:16:17.491355 IP (tos 0x0, ttl 252, id 16388, offset 0, flags [DF], proto TCP (6), length 785)
    10.80.65.146.8080 > 10.18.191.67.44332: Flags [P.], cksum 0xcb4d (correct), seq 1181:1914, ack 1963, win 121, options [nop,nop,TS val 297495772 ecr 3662857008], length 733: HTTP, length: 733

19:16:17.491367 IP (tos 0x0, ttl 255, id 57098, offset 0, flags [DF], proto TCP (6), length 52)
    10.18.191.67.44332 > 10.80.65.146.8080: Flags [.], cksum 0x155e (incorrect -> 0x11ca), ack 1914, win 478, options [nop,nop,TS val 3662857029 ecr 297495772], length 0

19:16:28.241150 IP (tos 0x0, ttl 255, id 57099, offset 0, flags [DF], proto TCP (6), length 723)
    10.18.191.67.44332 > 10.80.65.146.8080: Flags [P.], cksum 0x17fd (incorrect -> 0x828f), seq 1963:2634, ack 1914, win 478, options [nop,nop,TS val 3662867779 ecr 297495772], length 671: HTTP, length: 671

19:16:28.259600 IP (tos 0x0, ttl 252, id 16389, offset 0, flags [DF], proto TCP (6), length 785)
    10.80.65.146.8080 > 10.18.191.67.44332: Flags [P.], cksum 0x917e (correct), seq 1914:2647, ack 2634, win 126, options [nop,nop,TS val 297496849 ecr 3662867779], length 733: HTTP, length: 733

19:16:28.259617 IP (tos 0x0, ttl 255, id 57100, offset 0, flags [DF], proto TCP (6), length 52)
    10.18.191.67.44332 > 10.80.65.146.8080: Flags [.], cksum 0x155e (incorrect -> 0xde0d), ack 2647, win 473, options [nop,nop,TS val 3662867797 ecr 297496849], length 0

19:17:25.287512 IP (tos 0x0, ttl 255, id 57101, offset 0, flags [DF], proto TCP (6), length 723)
    10.18.191.67.44332 > 10.80.65.146.8080: Flags [P.], cksum 0x17fd (incorrect -> 0x83c7), seq 2634:3305, ack 2647, win 473, options [nop,nop,TS val 3662924825 ecr 297496849], length 671: HTTP, length: 671

19:17:25.289906 IP (tos 0x0, ttl 252, id 16390, offset 0, flags [DF], proto TCP (6), length 52)
    10.80.65.146.8080 > 10.18.191.67.44332: Flags [R.], cksum 0xe7b4 (correct), seq 2647, ack 3305, win 131, options [nop,nop,TS val 297502552 ecr 3662924825], length 0
```

In this, because Envoy didnt generate ```[F.]``` flag, client never knew connection was triggered for close and received reset exception. Any ideas, why it can happen this way. Is there any property I am not making use of which can help in this scenario.

This is not happening in all the cases, but only for few of them.  Any leads in this would be very helpful.

**Note** : configurations like delayed_close_timeout, drain_timeout, max_stream_duration are not set in configuration and defaults are used for them.

**Comment by prateek0394** [comment]
Hi guys,

Can someone help me in this?

Thanks.

**Comment by dvob** [comment]
@prateek0394 we have similar problems in our environment. To avoid such errors you should set the max connection time of the HTTP client (your customer) lower then the max connection time on Envoy. This way the client will terminate the connection and you don't have the case where Envoy is closing the connection and at the same time the client tries to send data.
In many cases it probably also makes more sense to use `idle_timeout`, because then you close the connection only if it was not used for that period.

From what I understand in your tcpdump the following thing happens:
```
19:15:19 connection start
19:17:19 (+120s max_connection_duration) 
  -> connection termination starts
  -> header `Connection: close` is set
19:17:24 (+5s drain_timeout) 
  -> no new data accepted, no FIN sent yet
  -> requests are answered with connection reset
19:17:25 (+1s delayed_close_timeout) envoy sends FIN
```

If a request is sent after the `drain_timeout` and before the `delayed_close_timeout` elapses Envoy answers your request with a connection reset.
