### ISSUE TITLE
dns: abnormal DNS resolve retry behaviour

### ISSUE THREAD

**Issue by hdeheer** [envoyproxy/envoy#44469]
*Title*: *abnormal DNS resolve retry behaviour*

*Description*:
During a DR test, hosts were not able to reach the DNS resolvers, after connectivity was restored, we noticed an abnormal DNS resolve retry behaviour.
Records that were requested (eg. test42.blabla.example.com) were being looked up over and over again (for more than an hour), we didn’t notice any max retries being respected.

We managed to remove the additional .example.com lookup and AAAA lookup(see logs below), by tuning resolv.conf: `options timeout:1 no-aaaa ndots:2`.

But we still see a lot of retries (100+) on a single dig try.
Expected behaviour on `dig test42.blabla.example.com`:
- istio / envoy / c-ares will try x times to resolve, but on i/o timeout it should only try x times, and then stop trying.

Looking at the logs it also looks like Envoy will loadbalance over all `nameservers` found in `/etc/resolv.conf` instead of following the order as provided in the config file.

*Repro steps*:
Configure resolv.conf as stated below.
Make the dns resolvers unreachable.

*Config*:
current config:
**/etc/resolv.conf**
```
domain example.com
search example.com
nameserver 127.0.0.1
nameserver 10.94.0.53
nameserver 10.94.1.53
options timeout:1
```
**/etc/dnsmasq.conf**
```
# MAIN CONFIG START
domain-needed
port=53
 
listen-address=127.0.0.1
no-negcache
no-resolv
expand-hosts
cache-size=1000
conf-dir=/etc/dnsmasq.d
dns-forward-max=10000
#MAIN CONFIG END
 
# EXTENDED CONFIG
all-servers
bind-interfaces
# EXTENDED CONFIG END
address=/.gcr.io/10.35.28.1
address=/.googleapis.com/10.35.28.1
address=/accounts.google.com/10.35.28.1
address=/europe-docker.pkg.dev/10.35.28.1
address=/europe-west4-docker.pkg.dev/10.35.28.1
address=/istiod.istio-system.svc/10.35.50.118
address=/us-docker.pkg.dev/10.35.28.1
#address=/ingest-nonpro.observability.example.com/10.132.0.2
server=10.94.0.53#53
server=10.94.1.53#53
```

*Logs*:
```
{"level":"info","time":"2026-02-17T15:35:27.466966Z","scope":"dns","msg":"upstream failure: read udp 127.0.0.1:36071->127.0.0.1:53: i/o timeout"}
{"level":"info","time":"2026-02-17T15:35:27.467070Z","scope":"dns","msg":"upstream failure: read udp 127.0.0.1:47187->127.0.0.1:53: i/o timeout"}
{"level":"info","time":"2026-02-17T15:35:27.467098Z","scope":"dns","msg":"upstream failure: read udp 10.132.97.38:52232->10.94.0.53:53: i/o timeout"}
{"level":"info","time":"2026-02-17T15:35:27.528178Z","scope":"dns","msg":"upstream failure: read udp 10.132.97.38:60975->10.94.1.53:53: i/o timeout"}
{"level":"info","time":"2026-02-17T15:35:27.467189Z","scope":"dns","msg":"upstream failure: read udp 10.132.97.38:36424->10.94.0.53:53: i/o timeout"}
{"level":"info","time":"2026-02-17T15:35:27.467203Z","scope":"dns","msg":"upstream failure: read udp 127.0.0.1:41663->127.0.0.1:53: i/o timeout"}
{"level":"info","time":"2026-02-17T15:35:27.467281Z","scope":"dns","msg":"upstream failure: read udp 127.0.0.1:46775->127.0.0.1:53: i/o timeout"}
{"level":"info","time":"2026-02-17T15:35:27.467399Z","scope":"dns","msg":"upstream failure: read udp 10.132.97.38:44867->10.94.1.53:53: i/o timeout"}
{"level":"info","time":"2026-02-17T15:35:27.467413Z","scope":"dns","msg":"upstream failure: read udp 10.132.97.38:41466->10.94.0.53:53: i/o timeout"}
```

When looking at tcpdump, while doing a `dig test42.blabla.example.com ` we see:
```
13:06:56.682185 IP 10.132.101.54.37592 > 10.94.1.53.domain: 11821+ [1au] AAAA? test42.blabla.example.com. (52)
13:06:56.682206 IP 10.132.101.54.55694 > 10.94.1.53.domain: 37480+ [1au] A? test42.blabla.example.com. (52)
13:06:57.682450 IP 10.132.101.54.44310 > 10.94.0.53.domain: 54459+ [1au] A? test42.blabla.example.com. (52)
13:06:57.682619 IP 10.132.101.54.42416 > 10.94.0.53.domain: 22033+ [1au] AAAA? test42.blabla.example.com. (52)
13:06:58.682709 IP 10.132.101.54.38014 > 10.94.1.53.domain: 9892+ [1au] A? test42.blabla.example.com. (52)
13:06:58.682773 IP 10.132.101.54.51202 > 10.94.1.53.domain: 2612+ [1au] AAAA? test42.blabla.example.com. (52)
13:06:59.683173 IP 10.132.101.54.36253 > 10.94.0.53.domain: 10384+ [1au] A? test42.blabla.example.com. (52)
13:06:59.683192 IP 10.132.101.54.41992 > 10.94.0.53.domain: 35807+ [1au] AAAA? test42.blabla.example.com. (52)
13:07:00.684589 IP 10.132.101.54.47027 > 10.94.1.53.domain: 27622+ [1au] AAAA? test42.blabla.example.com.example.com. (63)
13:07:00.684652 IP 10.132.101.54.55796 > 10.94.1.53.domain: 23993+ [1au] A? test42.blabla.example.com.example.com. (63)
13:07:01.684909 IP 10.132.101.54.36981 > 10.94.0.53.domain: 44444+ [1au] AAAA? test42.blabla.example.com.example.com. (63)
13:07:01.684931 IP 10.132.101.54.37574 > 10.94.0.53.domain: 15828+ [1au] A? test42.blabla.example.com.example.com. (63)
```

**Comment by phlax** [comment]
cc @yanjunxiang-google @yanavlasov @mattklein123

**Comment by yanjunxiang-google** [comment]
@hdeheer ,

Thanks for reporting the issue!  Regarding your questions:

1) "Looking at the logs it also looks like Envoy will loadbalance over all nameservers found in /etc/resolv.conf instead of following the order as provided in the config file."

----  Envoy has a rotate_nameservers configuration :https://github.com/envoyproxy/envoy/blob/29d3a88a5ffd50696d477ea979997ae0a241431b/api/envoy/extensions/network/dns_resolver/cares/v3/cares_dns_resolver.proto#L80.  If set to true, it will enable round-robin selection of name servers for DNS resolution.

2) "DNS queries are sent repeatedly without max retries"

---- Envoy has a "udp_max_queries" configuration: https://github.com/envoyproxy/envoy/blob/29d3a88a5ffd50696d477ea979997ae0a241431b/api/envoy/extensions/network/dns_resolver/cares/v3/cares_dns_resolver.proto#L54.  Could you please double check what's the number there?

Could you please share the entire Envoy CaresDnsResolverConfig: https://github.com/envoyproxy/envoy/blob/29d3a88a5ffd50696d477ea979997ae0a241431b/api/envoy/extensions/network/dns_resolver/cares/v3/cares_dns_resolver.proto#L25

**Comment by hdeheer** [comment]
@yanjunxiang-google thanks for your reply.

1. rotate_nameserver
I don't see a specific override for this, which would mean envoy's DNS resolving falls back to the next configured resolver when the first one fails.

2. udp_max_queries.
This value is set to `100`.
https://github.com/istio/istio/blob/master/pilot/pkg/features/pilot.go#L82

3. the config
```
"typed_dns_resolver_config": {
 "name": "envoy.network.dns_resolver.cares",
 "typed_config": {
  "@type": "type.googleapis.com/envoy.extensions.network.dns_resolver.cares.v3.CaresDnsResolverConfig",
  "udp_max_queries": 100
 }
},
"dns_jitter": "0.100s"
```
