### ISSUE TITLE
Connection gets closed multiple times when downloading 1GB file using HTTP filter (HCM)

### ISSUE THREAD

**Issue by oblazek** [envoyproxy/envoy#7775]
Hi, I have run into strange (to me) behavior when using `hcm` compared to `tcp proxy`.
I have a backend server (actually 2 k8s pods) serving static ~1GB file which I thought should be possible to download easily using http (hcm), but it seems that after a while connection gets closed, which is unwanted.

```
$ wget 10.0.0.1:1111/file

--2019-07-30 16:00:36--  http://10.0.0.1:1111/file
Connecting to 10.0.0.1:1111... connected.
HTTP request sent, awaiting response... 200 OK
Length: 1048576000 (1000M) [application/octet-stream]
Saving to: ‘file.1’
.
.
.
file.1                                                   2%[==>                                                                                                                                        ]  22,88M  1017KB/s    in 24s     

2019-07-30 16:01:00 (984 KB/s) - Connection closed at byte 23988520. Retrying.

--2019-07-30 16:01:01--  (try: 2)  http://10.0.0.1:1111/file
Connecting to 10.0.0.1:1111... connected.
HTTP request sent, awaiting response... 206 Partial Content
Length: 1048576000 (1000M), 1024587480 (977M) remaining [application/octet-stream]
Saving to: ‘file.1’

file.1                                                   4%[+++==>                                                                                                                                     ]  46,07M  1006KB/s    in 24s     

2019-07-30 16:01:25 (981 KB/s) - Connection closed at byte 48311995. Retrying.

--2019-07-30 16:01:27--  (try: 3)  http://10.0.0.1:1111/file.txt
Connecting to 10.0.0.1:1111... connected.
HTTP request sent, awaiting response... 206 Partial Content
Length: 1048576000 (1000M), 1000264005 (954M) remaining [application/octet-stream]
Saving to: ‘file.txt.13’

file.1                                                   6%[++++++==>
```
strangely when I switch to tcp proxy, file gets downloaded without any interruption.:
```
$ wget 10.0.0.1:1111/file

--2019-07-30 16:09:23--  http://10.0.0.1:1111/file.txt
Connecting to 10.0.0.1:1111... connected.
HTTP request sent, awaiting response... 200 OK
Length: 1048576000 (1000M) [application/octet-stream]
Saving to: ‘file.1’

file.1                                                 100%[==========================================================================================================================================>]   1000M  9,54MB/s    in 1m 45s  3

2019-07-30 16:11:08 (9,50 MB/s) - ‘file.1’ saved [1048576000/1048576000]
```

Is there some limitation which I missed? I tried multiple tests with `PerConnectionBufferLimitBytes`, `InitialStreamWindowSize` or `InitialConnectionWindowSize` but without any success.

I am possitive I am not draining the node or anything like that. 

For configuration I am using xDS.:
```
{
     "version_info": "2019-07-30 16:00:27.892280786 +0200 CEST m=+4.505935142",
     "cluster": {
      "name": "k8s_demo",
      "connect_timeout": "6s",
      "health_checks": [
       {
        "timeout": "2s",
        "interval": "5s",
        "unhealthy_threshold": 0,
        "healthy_threshold": 0,
        "reuse_connection": true,
        "tcp_health_check": {}
       }
      ],
      "outlier_detection": {
       "consecutive_5xx": 3,
       "interval": "5s",
       "max_ejection_percent": 20
      },
      "load_assignment": {
       "cluster_name": "k8s_demo",
       "endpoints": [
        {
         "lb_endpoints": [
          {
           "endpoint": {
            "address": {
             "socket_address": {
              "address": "10.1.0.1",
              "port_value": 8080
             }
            }
           },
           "load_balancing_weight": 1
          },
          {
           "endpoint": {
            "address": {
             "socket_address": {
              "address": "10.1.0.2",
              "port_value": 8080
             }
            }
           },
           "load_balancing_weight": 1
          }
         ],
         "load_balancing_weight": 1
        }
       ]
      }
     },
     "last_updated": "2019-07-30T14:00:28.798Z"
    },

.
.
.

{
     "version_info": "2019-07-30 16:15:46.580400521 +0200 CEST m=+923.194054723",
     "listener": {
      "name": "k8s_demo",
      "address": {
       "socket_address": {
        "address": "10.0.0.1",
        "port_value": 1111
       }
      },
      "filter_chains": [
       {
        "filters": [
         {
          "name": "envoy.http_connection_manager",
          "config": {
           "stat_prefix": "k8s_demo",
           "use_remote_address": true,
           "route_config": {
            "virtual_hosts": [
             {
              "name": "k8s_demo",
              "routes": [
               {
                "route": {
                 "cluster": "k8s_demo"
                },
                "match": {
                 "prefix": "/"
                }
               }
              ],
              "domains": [
               "*"
              ]
             }
            ],
            "name": "k8s_demo"
           },
           "http_filters": [
            {
             "name": "envoy.router",
             "config": null
            }
           ]
          }
         }
        ]
       }
      ],
      "freebind": true
     },
     "last_updated": "2019-07-30T14:15:46.589Z"
    },


```

Any help? 
>`./envoy  version: 95ef6bc43daeda16451ad4ef20979d8e07a5299/1.10.0/Clean/RELEASE/BoringSSL`

**Comment by mattklein123** [comment]
Please try on current master and also stats output during the failure cases would be very useful.

**Comment by oblazek** [comment]
ok, will try that first thing tomorrow morning and will let you know

**Comment by oblazek** [comment]
@mattklein123 just tested with `envoy  version: bf169f9d3c8f4c682650c5390c088a4898940913/1.11.0/Clean/RELEASE/BoringSSL`
with the same problem. 
This is the stats output:
```
cluster.k8s_demo.assignment_stale: 0
cluster.k8s_demo.assignment_timeout_received: 0
cluster.k8s_demo.bind_errors: 0
cluster.k8s_demo.circuit_breakers.default.cx_open: 0
cluster.k8s_demo.circuit_breakers.default.cx_pool_open: 0
cluster.k8s_demo.circuit_breakers.default.rq_open: 0
cluster.k8s_demo.circuit_breakers.default.rq_pending_open: 0
cluster.k8s_demo.circuit_breakers.default.rq_retry_open: 0
cluster.k8s_demo.circuit_breakers.high.cx_open: 0
cluster.k8s_demo.circuit_breakers.high.cx_pool_open: 0
cluster.k8s_demo.circuit_breakers.high.rq_open: 0
cluster.k8s_demo.circuit_breakers.high.rq_pending_open: 0
cluster.k8s_demo.circuit_breakers.high.rq_retry_open: 0
cluster.k8s_demo.health_check.attempt: 13072
cluster.k8s_demo.health_check.degraded: 0
cluster.k8s_demo.health_check.failure: 0
cluster.k8s_demo.health_check.healthy: 1
cluster.k8s_demo.health_check.network_failure: 0
cluster.k8s_demo.health_check.passive_failure: 0
cluster.k8s_demo.health_check.success: 13072
cluster.k8s_demo.health_check.verify_cluster: 0
cluster.k8s_demo.internal.upstream_rq_200: 3
cluster.k8s_demo.internal.upstream_rq_206: 5
cluster.k8s_demo.internal.upstream_rq_2xx: 8
cluster.k8s_demo.internal.upstream_rq_completed: 8
cluster.k8s_demo.lb_healthy_panic: 0
cluster.k8s_demo.lb_local_cluster_not_ok: 0
cluster.k8s_demo.lb_recalculate_zone_structures: 0
cluster.k8s_demo.lb_subsets_active: 0
cluster.k8s_demo.lb_subsets_created: 0
cluster.k8s_demo.lb_subsets_fallback: 0
cluster.k8s_demo.lb_subsets_fallback_panic: 0
cluster.k8s_demo.lb_subsets_removed: 0
cluster.k8s_demo.lb_subsets_selected: 0
cluster.k8s_demo.lb_zone_cluster_too_small: 0
cluster.k8s_demo.lb_zone_no_capacity_left: 0
cluster.k8s_demo.lb_zone_number_differs: 0
cluster.k8s_demo.lb_zone_routing_all_directly: 0
cluster.k8s_demo.lb_zone_routing_cross_zone: 0
cluster.k8s_demo.lb_zone_routing_sampled: 0
cluster.k8s_demo.max_host_weight: 0
cluster.k8s_demo.membership_change: 1
cluster.k8s_demo.membership_degraded: 0
cluster.k8s_demo.membership_excluded: 0
cluster.k8s_demo.membership_healthy: 1
cluster.k8s_demo.membership_total: 1
cluster.k8s_demo.original_dst_host_invalid: 0
cluster.k8s_demo.outlier_detection.ejections_active: 0
cluster.k8s_demo.outlier_detection.ejections_consecutive_5xx: 0
cluster.k8s_demo.outlier_detection.ejections_detected_consecutive_5xx: 0
cluster.k8s_demo.outlier_detection.ejections_detected_consecutive_gateway_failure: 0
cluster.k8s_demo.outlier_detection.ejections_detected_consecutive_local_origin_failure: 0
cluster.k8s_demo.outlier_detection.ejections_detected_local_origin_success_rate: 0
cluster.k8s_demo.outlier_detection.ejections_detected_success_rate: 0
cluster.k8s_demo.outlier_detection.ejections_enforced_consecutive_5xx: 0
cluster.k8s_demo.outlier_detection.ejections_enforced_consecutive_gateway_failure: 0
cluster.k8s_demo.outlier_detection.ejections_enforced_consecutive_local_origin_failure: 0
cluster.k8s_demo.outlier_detection.ejections_enforced_local_origin_success_rate: 0
cluster.k8s_demo.outlier_detection.ejections_enforced_success_rate: 0
cluster.k8s_demo.outlier_detection.ejections_enforced_total: 0
cluster.k8s_demo.outlier_detection.ejections_overflow: 0
cluster.k8s_demo.outlier_detection.ejections_success_rate: 0
cluster.k8s_demo.outlier_detection.ejections_total: 0
cluster.k8s_demo.retry_or_shadow_abandoned: 0
cluster.k8s_demo.update_attempt: 0
cluster.k8s_demo.update_empty: 0
cluster.k8s_demo.update_failure: 0
cluster.k8s_demo.update_no_rebuild: 0
cluster.k8s_demo.update_success: 0
cluster.k8s_demo.upstream_cx_active: 3
cluster.k8s_demo.upstream_cx_close_notify: 0
cluster.k8s_demo.upstream_cx_connect_attempts_exceeded: 0
cluster.k8s_demo.upstream_cx_connect_fail: 0
cluster.k8s_demo.upstream_cx_connect_timeout: 0
cluster.k8s_demo.upstream_cx_destroy: 40
cluster.k8s_demo.upstream_cx_destroy_local: 5
cluster.k8s_demo.upstream_cx_destroy_local_with_active_rq: 5
cluster.k8s_demo.upstream_cx_destroy_remote: 35
cluster.k8s_demo.upstream_cx_destroy_remote_with_active_rq: 35
cluster.k8s_demo.upstream_cx_destroy_with_active_rq: 40
cluster.k8s_demo.upstream_cx_http1_total: 8
cluster.k8s_demo.upstream_cx_http2_total: 0
cluster.k8s_demo.upstream_cx_idle_timeout: 0
cluster.k8s_demo.upstream_cx_max_requests: 0
cluster.k8s_demo.upstream_cx_none_healthy: 0
cluster.k8s_demo.upstream_cx_overflow: 0
cluster.k8s_demo.upstream_cx_pool_overflow: 0
cluster.k8s_demo.upstream_cx_protocol_error: 0
cluster.k8s_demo.upstream_cx_rx_bytes_buffered: 932926
cluster.k8s_demo.upstream_cx_rx_bytes_total: 18700193
cluster.k8s_demo.upstream_cx_total: 43
cluster.k8s_demo.upstream_cx_tx_bytes_buffered: 0
cluster.k8s_demo.upstream_cx_tx_bytes_total: 5428
cluster.k8s_demo.upstream_flow_control_backed_up_total: 0
cluster.k8s_demo.upstream_flow_control_drained_total: 0
cluster.k8s_demo.upstream_flow_control_paused_reading_total: 15
cluster.k8s_demo.upstream_flow_control_resumed_reading_total: 9
cluster.k8s_demo.upstream_internal_redirect_failed_total: 0
cluster.k8s_demo.upstream_internal_redirect_succeeded_total: 0
cluster.k8s_demo.upstream_rq_200: 3
cluster.k8s_demo.upstream_rq_206: 5
cluster.k8s_demo.upstream_rq_2xx: 8
cluster.k8s_demo.upstream_rq_active: 1
cluster.k8s_demo.upstream_rq_cancelled: 0
cluster.k8s_demo.upstream_rq_completed: 8
cluster.k8s_demo.upstream_rq_maintenance_mode: 0
cluster.k8s_demo.upstream_rq_pending_active: 0
cluster.k8s_demo.upstream_rq_pending_failure_eject: 0
cluster.k8s_demo.upstream_rq_pending_overflow: 0
cluster.k8s_demo.upstream_rq_pending_total: 43
cluster.k8s_demo.upstream_rq_per_try_timeout: 0
cluster.k8s_demo.upstream_rq_retry: 0
cluster.k8s_demo.upstream_rq_retry_overflow: 0
cluster.k8s_demo.upstream_rq_retry_success: 0
cluster.k8s_demo.upstream_rq_rx_reset: 0
cluster.k8s_demo.upstream_rq_timeout: 0
cluster.k8s_demo.upstream_rq_total: 43
cluster.k8s_demo.upstream_rq_tx_reset: 0
cluster.k8s_demo.version: 0



http.k8s_demo.downstream_cx_active: 1
http.k8s_demo.downstream_cx_delayed_close_timeout: 5
http.k8s_demo.downstream_cx_destroy: 7
http.k8s_demo.downstream_cx_destroy_active_rq: 0
http.k8s_demo.downstream_cx_destroy_local: 5
http.k8s_demo.downstream_cx_destroy_local_active_rq: 0
http.k8s_demo.downstream_cx_destroy_remote: 2
http.k8s_demo.downstream_cx_destroy_remote_active_rq: 0
http.k8s_demo.downstream_cx_drain_close: 0
http.k8s_demo.downstream_cx_http1_active: 1
http.k8s_demo.downstream_cx_http1_total: 8
http.k8s_demo.downstream_cx_http2_active: 0
http.k8s_demo.downstream_cx_http2_total: 0
http.k8s_demo.downstream_cx_idle_timeout: 0
http.k8s_demo.downstream_cx_overload_disable_keepalive: 0
http.k8s_demo.downstream_cx_protocol_error: 0
http.k8s_demo.downstream_cx_rx_bytes_buffered: 177
http.k8s_demo.downstream_cx_rx_bytes_total: 1198
http.k8s_demo.downstream_cx_ssl_active: 0
http.k8s_demo.downstream_cx_ssl_total: 0
http.k8s_demo.downstream_cx_total: 8
http.k8s_demo.downstream_cx_tx_bytes_buffered: 1344072
http.k8s_demo.downstream_cx_tx_bytes_total: 12767596
http.k8s_demo.downstream_cx_upgrades_active: 0
http.k8s_demo.downstream_cx_upgrades_total: 0
http.k8s_demo.downstream_flow_control_paused_reading_total: 0
http.k8s_demo.downstream_flow_control_resumed_reading_total: 0
http.k8s_demo.downstream_rq_1xx: 0
http.k8s_demo.downstream_rq_2xx: 8
http.k8s_demo.downstream_rq_3xx: 0
http.k8s_demo.downstream_rq_4xx: 0
http.k8s_demo.downstream_rq_5xx: 0
http.k8s_demo.downstream_rq_active: 1
http.k8s_demo.downstream_rq_completed: 8
http.k8s_demo.downstream_rq_http1_total: 8
http.k8s_demo.downstream_rq_http2_total: 0
http.k8s_demo.downstream_rq_idle_timeout: 0
http.k8s_demo.downstream_rq_non_relative_path: 0
http.k8s_demo.downstream_rq_overload_close: 0
http.k8s_demo.downstream_rq_response_before_rq_complete: 0
http.k8s_demo.downstream_rq_rx_reset: 5
http.k8s_demo.downstream_rq_timeout: 0
http.k8s_demo.downstream_rq_too_large: 0
http.k8s_demo.downstream_rq_total: 8
http.k8s_demo.downstream_rq_tx_reset: 5
http.k8s_demo.downstream_rq_ws_on_non_ws_route: 0
http.k8s_demo.no_cluster: 0
http.k8s_demo.no_route: 0
http.k8s_demo.rq_direct_response: 0
http.k8s_demo.rq_redirect: 0
http.k8s_demo.rq_reset_after_downstream_response_started: 0
http.k8s_demo.rq_total: 8
http.k8s_demo.rs_too_large: 0
http.k8s_demo.tracing.client_enabled: 0
http.k8s_demo.tracing.health_check: 0
http.k8s_demo.tracing.not_traceable: 0
http.k8s_demo.tracing.random_sampling: 0
http.k8s_demo.tracing.service_forced: 0


listener.10.0.0.1_1111.http.k8s_demo.downstream_rq_1xx: 0
listener.10.0.0.1_1111.http.k8s_demo.downstream_rq_2xx: 8
listener.10.0.0.1_1111.http.k8s_demo.downstream_rq_3xx: 0
listener.10.0.0.1_1111.http.k8s_demo.downstream_rq_4xx: 0
listener.10.0.0.1_1111.http.k8s_demo.downstream_rq_5xx: 0
listener.10.0.0.1_1111.http.k8s_demo.downstream_rq_completed: 8


cluster.k8s_demo.internal.upstream_rq_time: P0(nan,1) P25(nan,1.025) P50(nan,1.05) P75(nan,1.075) P90(nan,1.09) P95(nan,1.095) P99(nan,1.099) P99.5(nan,1.0995) P99.9(nan,1.0999) P100(nan,1.1)
cluster.k8s_demo.upstream_cx_connect_ms: P0(0,0) P25(0,0) P50(0,0) P75(0,0) P90(0,0) P95(0,0) P99(0,0) P99.5(0,0) P99.9(0,0) P100(0,0)
cluster.k8s_demo.upstream_cx_length_ms: P0(nan,8) P25(nan,10.0526) P50(nan,10.5789) P75(nan,11.6667) P90(nan,14333.3) P95(nan,15000) P99(nan,15800) P99.5(nan,15900) P99.9(nan,15980) P100(nan,16000)
cluster.k8s_demo.upstream_rq_time: P0(nan,1) P25(nan,1.025) P50(nan,1.05) P75(nan,1.075) P90(nan,1.09) P95(nan,1.095) P99(nan,1.099) P99.5(nan,1.0995) P99.9(nan,1.0999) P100(nan,1.1)

http.k8s_demo.downstream_cx_length_ms: P0(nan,10) P25(nan,12.75) P50(nan,15750) P75(nan,16416.7) P90(nan,16766.7) P95(nan,16883.3) P99(nan,16976.7) P99.5(nan,16988.3) P99.9(nan,16997.7) P100(nan,17000)
http.k8s_demo.downstream_rq_time: P0(nan,1) P25(nan,1.05) P50(nan,1.1) P75(nan,2.05) P90(nan,2.08) P95(nan,2.09) P99(nan,2.098) P99.5(nan,2.099) P99.9(nan,2.0998) P100(nan,2.1)
```
not sure what to look for :/

I will try building from source (after I find out how) and try again.

**Comment by oblazek** [comment]
new stats with `envoy  version: fc8d6f5fe4fdfa62e736ba50122c312871e92208/1.12.0-dev/Clean/RELEASE/BoringSSL`
```
cluster.k8s_demo.assignment_stale: 0                                                                                                                                                                                                           
cluster.k8s_demo.assignment_timeout_received: 0                                                                                                                                                                                                
cluster.k8s_demo.bind_errors: 0                                                                                                                                                                                                                
cluster.k8s_demo.circuit_breakers.default.cx_open: 0                                                                                                                                                                                           
cluster.k8s_demo.circuit_breakers.default.cx_pool_open: 0                                                                                                                                                                                      
cluster.k8s_demo.circuit_breakers.default.rq_open: 0                                                                                                                                                                                           
cluster.k8s_demo.circuit_breakers.default.rq_pending_open: 0                                                                                                                                                                                   
cluster.k8s_demo.circuit_breakers.default.rq_retry_open: 0                                                                                                                                                                                     
cluster.k8s_demo.circuit_breakers.high.cx_open: 0                                                                                                                                                                                              
cluster.k8s_demo.circuit_breakers.high.cx_pool_open: 0                                                                                                                                                                                         
cluster.k8s_demo.circuit_breakers.high.rq_open: 0                                                                                                                                                                                              
cluster.k8s_demo.circuit_breakers.high.rq_pending_open: 0                                                                                                                                                                                      
cluster.k8s_demo.circuit_breakers.high.rq_retry_open: 0                                                                                                                                                                                        
cluster.k8s_demo.health_check.attempt: 12                                                                                                                                                                                                      
cluster.k8s_demo.health_check.degraded: 0                                                                                                                                                                                                      
cluster.k8s_demo.health_check.failure: 0
cluster.k8s_demo.health_check.healthy: 1
cluster.k8s_demo.health_check.network_failure: 0
cluster.k8s_demo.health_check.passive_failure: 0
cluster.k8s_demo.health_check.success: 12
cluster.k8s_demo.health_check.verify_cluster: 0
cluster.k8s_demo.internal.upstream_rq_200: 1
cluster.k8s_demo.internal.upstream_rq_206: 4
cluster.k8s_demo.internal.upstream_rq_2xx: 5
cluster.k8s_demo.internal.upstream_rq_completed: 5
cluster.k8s_demo.lb_healthy_panic: 0
cluster.k8s_demo.lb_local_cluster_not_ok: 0
cluster.k8s_demo.lb_recalculate_zone_structures: 0
cluster.k8s_demo.lb_subsets_active: 0
cluster.k8s_demo.lb_subsets_created: 0
cluster.k8s_demo.lb_subsets_fallback: 0
cluster.k8s_demo.lb_subsets_fallback_panic: 0
cluster.k8s_demo.lb_subsets_removed: 0
cluster.k8s_demo.lb_subsets_selected: 0
cluster.k8s_demo.lb_zone_cluster_too_small: 0
cluster.k8s_demo.lb_zone_no_capacity_left: 0
cluster.k8s_demo.lb_zone_number_differs: 0
cluster.k8s_demo.lb_zone_routing_all_directly: 0
cluster.k8s_demo.lb_zone_routing_cross_zone: 0
cluster.k8s_demo.lb_zone_routing_sampled: 0
cluster.k8s_demo.max_host_weight: 0
cluster.k8s_demo.membership_change: 1
cluster.k8s_demo.membership_degraded: 0
cluster.k8s_demo.membership_excluded: 0
cluster.k8s_demo.membership_healthy: 1
cluster.k8s_demo.membership_total: 1
cluster.k8s_demo.original_dst_host_invalid: 0
cluster.k8s_demo.outlier_detection.ejections_active: 0
cluster.k8s_demo.outlier_detection.ejections_consecutive_5xx: 0
cluster.k8s_demo.outlier_detection.ejections_detected_consecutive_5xx: 0
cluster.k8s_demo.outlier_detection.ejections_detected_consecutive_gateway_failure: 0
cluster.k8s_demo.outlier_detection.ejections_detected_consecutive_local_origin_failure: 0
cluster.k8s_demo.outlier_detection.ejections_detected_local_origin_success_rate: 0
cluster.k8s_demo.outlier_detection.ejections_detected_success_rate: 0
cluster.k8s_demo.outlier_detection.ejections_enforced_consecutive_5xx: 0
cluster.k8s_demo.outlier_detection.ejections_enforced_consecutive_gateway_failure: 0
cluster.k8s_demo.outlier_detection.ejections_enforced_consecutive_local_origin_failure: 0
cluster.k8s_demo.outlier_detection.ejections_enforced_local_origin_success_rate: 0
cluster.k8s_demo.outlier_detection.ejections_enforced_success_rate: 0
cluster.k8s_demo.outlier_detection.ejections_enforced_total: 0
cluster.k8s_demo.outlier_detection.ejections_overflow: 0
cluster.k8s_demo.outlier_detection.ejections_success_rate: 0
cluster.k8s_demo.outlier_detection.ejections_total: 0
cluster.k8s_demo.retry_or_shadow_abandoned: 0
cluster.k8s_demo.update_attempt: 0
cluster.k8s_demo.update_empty: 0
cluster.k8s_demo.update_failure: 0
cluster.k8s_demo.update_no_rebuild: 0
cluster.k8s_demo.update_success: 0
cluster.k8s_demo.upstream_cx_active: 1
cluster.k8s_demo.upstream_cx_close_notify: 0
cluster.k8s_demo.upstream_cx_connect_attempts_exceeded: 0
cluster.k8s_demo.upstream_cx_connect_fail: 0
cluster.k8s_demo.upstream_cx_connect_timeout: 0
cluster.k8s_demo.upstream_cx_destroy: 4
cluster.k8s_demo.upstream_cx_destroy_local: 4
cluster.k8s_demo.upstream_cx_destroy_local_with_active_rq: 4
cluster.k8s_demo.upstream_cx_destroy_remote: 0
cluster.k8s_demo.upstream_cx_destroy_remote_with_active_rq: 0
cluster.k8s_demo.upstream_cx_destroy_with_active_rq: 4
cluster.k8s_demo.upstream_cx_http1_total: 5
cluster.k8s_demo.upstream_cx_http2_total: 0
cluster.k8s_demo.upstream_cx_idle_timeout: 0
cluster.k8s_demo.upstream_cx_max_requests: 0
cluster.k8s_demo.upstream_cx_none_healthy: 0
cluster.k8s_demo.upstream_cx_overflow: 0
cluster.k8s_demo.upstream_cx_pool_overflow: 0
cluster.k8s_demo.upstream_cx_protocol_error: 0
cluster.k8s_demo.upstream_cx_rx_bytes_buffered: 1048576
cluster.k8s_demo.upstream_cx_rx_bytes_total: 86715558
cluster.k8s_demo.upstream_cx_total: 5
cluster.k8s_demo.upstream_cx_tx_bytes_buffered: 0
cluster.k8s_demo.upstream_cx_tx_bytes_total: 1681
cluster.k8s_demo.upstream_flow_control_backed_up_total: 0
cluster.k8s_demo.upstream_flow_control_drained_total: 0
cluster.k8s_demo.upstream_flow_control_paused_reading_total: 64
cluster.k8s_demo.upstream_flow_control_resumed_reading_total: 59
cluster.k8s_demo.upstream_internal_redirect_failed_total: 0
cluster.k8s_demo.upstream_internal_redirect_succeeded_total: 0
cluster.k8s_demo.upstream_rq_200: 1
cluster.k8s_demo.upstream_rq_206: 4
cluster.k8s_demo.upstream_rq_2xx: 5
cluster.k8s_demo.upstream_rq_active: 1
cluster.k8s_demo.upstream_rq_cancelled: 0
cluster.k8s_demo.upstream_rq_completed: 5
cluster.k8s_demo.upstream_rq_maintenance_mode: 0
cluster.k8s_demo.upstream_rq_pending_active: 0
cluster.k8s_demo.upstream_rq_pending_failure_eject: 0
cluster.k8s_demo.upstream_rq_pending_overflow: 0
cluster.k8s_demo.upstream_rq_pending_total: 5
cluster.k8s_demo.upstream_rq_per_try_timeout: 0
cluster.k8s_demo.upstream_rq_retry: 0
cluster.k8s_demo.upstream_rq_retry_overflow: 0
cluster.k8s_demo.upstream_rq_retry_success: 0
cluster.k8s_demo.upstream_rq_rx_reset: 0
cluster.k8s_demo.upstream_rq_timeout: 0
cluster.k8s_demo.upstream_rq_total: 5
cluster.k8s_demo.upstream_rq_tx_reset: 0
cluster.k8s_demo.version: 0

http.k8s_demo.downstream_cx_active: 1
http.k8s_demo.downstream_cx_delayed_close_timeout: 4
http.k8s_demo.downstream_cx_destroy: 4
http.k8s_demo.downstream_cx_destroy_active_rq: 0
http.k8s_demo.downstream_cx_destroy_local: 4
http.k8s_demo.downstream_cx_destroy_local_active_rq: 0
http.k8s_demo.downstream_cx_destroy_remote: 0
http.k8s_demo.downstream_cx_destroy_remote_active_rq: 0
http.k8s_demo.downstream_cx_drain_close: 0
http.k8s_demo.downstream_cx_http1_active: 1
http.k8s_demo.downstream_cx_http1_total: 5
http.k8s_demo.downstream_cx_http2_active: 0
http.k8s_demo.downstream_cx_http2_total: 0
http.k8s_demo.downstream_cx_idle_timeout: 0
http.k8s_demo.downstream_cx_overload_disable_keepalive: 0
http.k8s_demo.downstream_cx_protocol_error: 0
http.k8s_demo.downstream_cx_rx_bytes_buffered: 177
http.k8s_demo.downstream_cx_rx_bytes_total: 861
http.k8s_demo.downstream_cx_ssl_active: 0
http.k8s_demo.downstream_cx_ssl_total: 0
http.k8s_demo.downstream_cx_total: 5
http.k8s_demo.downstream_cx_tx_bytes_buffered: 566824
http.k8s_demo.downstream_cx_tx_bytes_total: 86148979
http.k8s_demo.downstream_cx_upgrades_active: 0
http.k8s_demo.downstream_cx_upgrades_total: 0
http.k8s_demo.downstream_flow_control_paused_reading_total: 0
http.k8s_demo.downstream_flow_control_resumed_reading_total: 0
http.k8s_demo.downstream_rq_1xx: 0
http.k8s_demo.downstream_rq_2xx: 5
http.k8s_demo.downstream_rq_3xx: 0
http.k8s_demo.downstream_rq_4xx: 0
http.k8s_demo.downstream_rq_5xx: 0
http.k8s_demo.downstream_rq_active: 1
http.k8s_demo.downstream_rq_completed: 5
http.k8s_demo.downstream_rq_http1_total: 5
http.k8s_demo.downstream_rq_http2_total: 0
http.k8s_demo.downstream_rq_idle_timeout: 0
http.k8s_demo.downstream_rq_non_relative_path: 0
http.k8s_demo.downstream_rq_overload_close: 0
http.k8s_demo.downstream_rq_response_before_rq_complete: 0
http.k8s_demo.downstream_rq_rx_reset: 4
http.k8s_demo.downstream_rq_timeout: 0
http.k8s_demo.downstream_rq_too_large: 0
http.k8s_demo.downstream_rq_total: 5
http.k8s_demo.downstream_rq_tx_reset: 4
http.k8s_demo.downstream_rq_ws_on_non_ws_route: 0
http.k8s_demo.no_cluster: 0
http.k8s_demo.no_route: 0
http.k8s_demo.rq_direct_response: 0
http.k8s_demo.rq_redirect: 0
http.k8s_demo.rq_reset_after_downstream_response_started: 0
http.k8s_demo.rq_retry_skipped_request_not_complete: 0
http.k8s_demo.rq_total: 5
http.k8s_demo.rs_too_large: 0
http.k8s_demo.tracing.client_enabled: 0
http.k8s_demo.tracing.health_check: 0
http.k8s_demo.tracing.not_traceable: 0
http.k8s_demo.tracing.random_sampling: 0
http.k8s_demo.tracing.service_forced: 0



listener.10.0.0.1_1111.http.k8s_demo.downstream_rq_1xx: 0
listener.10.0.0.1_1111.http.k8s_demo.downstream_rq_2xx: 5
listener.10.0.0.1_1111.http.k8s_demo.downstream_rq_3xx: 0
listener.10.0.0.1_1111.http.k8s_demo.downstream_rq_4xx: 0
listener.10.0.0.1_1111.http.k8s_demo.downstream_rq_5xx: 0
listener.10.0.0.1_1111.http.k8s_demo.downstream_rq_completed: 5


cluster.k8s_demo.upstream_cx_connect_ms: P0(nan,0) P25(nan,0) P50(nan,0) P75(nan,0) P90(nan,0) P95(nan,0) P99(nan,0) P99.5(nan,0) P99.9(nan,0) P100(nan,0)
cluster.k8s_demo.upstream_cx_length_ms: P0(nan,14000) P25(nan,15000) P50(nan,15333.3) P75(nan,15666.7) P90(nan,15866.7) P95(nan,15933.3) P99(nan,15986.7) P99.5(nan,15993.3) P99.9(nan,15998.7) P100(nan,16000)

http.k8s_demo.downstream_cx_length_ms: P0(nan,16000) P25(nan,17000) P50(nan,17500) P75(nan,18000) P90(nan,18600) P95(nan,18800) P99(nan,18960) P99.5(nan,18980) P99.9(nan,18996) P100(nan,19000)
http.k8s_demo.downstream_rq_time: No recorded values
```
at this point I got 4 times `connection closed` which corresponds with `downstream_cx_destroy`. Question is why :/

```
--2019-08-02 07:41:38--  http://10.0.0.1:1111/file
Connecting to 10.0.0.1:1111... connected.
HTTP request sent, awaiting response... 200 OK
Length: 1048576000 (1000M) [application/octet-stream]
Saving to: ‘file.1’

file.1                                                    1%[=>                                                                                                                                         ]  18,93M  1011KB/s    in 20s     

2019-08-02 07:41:58 (984 KB/s) - Connection closed at byte 19853544. Retrying.

--2019-08-02 07:41:59--  (try: 2)  http://10.0.0.1:1111/file
Connecting to 10.0.0.1:1111... connected.
HTTP request sent, awaiting response... 206 Partial Content
Length: 1048576000 (1000M), 1028722456 (981M) remaining [application/octet-stream]
Saving to: ‘file.1’

file.1                                                    3%[++==>                                                                                                                                      ]  36,81M   991KB/s    in 19s     

2019-08-02 07:42:17 (980 KB/s) - Connection closed at byte 38601040. Retrying.

--2019-08-02 07:42:19--  (try: 3)  http://10.0.0.1:1111/file
Connecting to 10.0.0.1:1111... connected.
HTTP request sent, awaiting response... 206 Partial Content
Length: 1048576000 (1000M), 1009974960 (963M) remaining [application/octet-stream]
Saving to: ‘file.1’

file.1                                                    5%[+++++=>                                                                                                                                    ]  55,01M  1022KB/s    in 19s     

2019-08-02 07:42:38 (986 KB/s) - Connection closed at byte 57684248. Retrying.

--2019-08-02 07:42:41--  (try: 4)  http://10.0.0.1:1111/file
Connecting to 10.0.0.1:1111... connected.
HTTP request sent, awaiting response... 206 Partial Content
Length: 1048576000 (1000M), 990891752 (945M) remaining [application/octet-stream]
Saving to: ‘file.1’

file.1                                                    7%[+++++++==>                                                                                                                                 ]  72,63M   977KB/s    in 18s     

2019-08-02 07:43:00 (977 KB/s) - Connection closed at byte 76159520. Retrying.

--2019-08-02 07:43:04--  (try: 5)  http://10.0.0.1:1111/file
Connecting to 10.0.0.1:1111... connected.
HTTP request sent, awaiting response... 206 Partial Content
Length: 1048576000 (1000M), 972416480 (927M) remaining [application/octet-stream]
Saving to: ‘file.1’

file.txt.1                                                    8%[++++++++++=> 
```

**Comment by oblazek** [comment]
Can you guys verify this? Whether you get the same issue? Static configuration with http filter should suffice and try downloading some bigger file.

**Comment by mattklein123** [comment]
@oblazek I looked through this and I'm guessing this closure is due to flow control somehow, but it's not clear to me what is going on from the stats we have. Are you able to repro on either debug or trace logging level? That would be useful. Also, if there is any way to put together a self contained repro using docker compose, etc. that would be nice. cc @alyssawilk who is out this week.

**Comment by oblazek** [comment]
@mattklein123 @alyssawilk sorry I was OOO last week.. 
Were you guys able to reproduce this yourself?
I was suspecting it could be a problem with my backend (which was custom go binary serving local file), but I just tested it with static nginx serving the same file and got the same result.

actual flow from tcpdump (first output has additional PUSH flag, otherwise flow is the same and continues this way during the whole time of the transfer):
```
09:18:16.123914 IP 10.0.0.1.1111 > my_machine.38856: Flags [FP.], seq 19920739:19923243, ack 171, win 59, options [nop,nop,TS val 4006125810 ecr 3240496095], length 2504
09:18:16.125259 IP my_machine.38856 > 10.0.0.1.1111: Flags [.], ack 19875247, win 1580, options [nop,nop,TS val 3240496103 ecr 4006125804], length 0
09:18:16.176894 IP my_machine.38856 > 10.0.0.1.1111: Flags [.], ack 19923244, win 1256, options [nop,nop,TS val 3240496146 ecr 4006125804], length 0
09:18:27.140791 IP my_machine.38856 > 10.0.0.1.1111: Flags [F.], seq 171, ack 19923244, win 4724, options [nop,nop,TS val 3240507119 ecr 4006125804], length 0
09:18:27.140826 IP 10.0.0.1.1111 > my_machine.38856: Flags [R], seq 3973407085, win 0, length 0
09:18:27.140832 IP my_machine.38860 > 10.0.0.1.1111: Flags [S], seq 766692110, win 29200, options [mss 1352,sackOK,TS val 3240507119 ecr 0,nop,wscale 7], length 0
09:18:27.140871 IP 10.0.0.1.1111 > my_machine.38860: Flags [S.], seq 541331182, ack 766692111, win 28960, options [mss 1460,sackOK,TS val 4006136829 ecr 3240507119,nop,wscale 9], length 0
09:18:27.149208 IP my_machine.38860 > 10.0.0.1.1111: Flags [.], ack 1, win 229, options [nop,nop,TS val 3240507127 ecr 4006136829], length 0
09:18:27.149298 IP my_machine.38860 > 10.0.0.1.1111: Flags [P.], seq 1:171, ack 1, win 229, options [nop,nop,TS val 3240507127 ecr 4006136829], length 170
09:18:27.149323 IP 10.0.0.1.1111 > my_machine.38860: Flags [.], ack 171, win 59, options [nop,nop,TS val 4006136837 ecr 3240507127], length 0
```
```
09:22:02.250146 IP 10.0.0.1.1111 > my_machine.39016: Flags [F.], seq 17899491, ack 171, win 59, options [nop,nop,TS val 798385429 ecr 3240722001], length 0
09:22:02.375798 IP my_machine.39016 > 10.0.0.1.1111: Flags [.], ack 17899492, win 3988, options [nop,nop,TS val 3240722354 ecr 798385429], length 0
09:22:12.842344 IP my_machine.39016 > 10.0.0.1.1111: Flags [F.], seq 171, ack 17899492, win 4723, options [nop,nop,TS val 3240732819 ecr 798385429], length 0
09:22:12.842385 IP 10.0.0.1.1111 > my_machine.39016: Flags [R], seq 1270206510, win 0, length 0
09:22:12.842390 IP my_machine.39028 > 10.0.0.1.1111: Flags [S], seq 3047880926, win 29200, options [mss 1352,sackOK,TS val 3240732819 ecr 0,nop,wscale 7], length 0
09:22:12.842439 IP 10.0.0.1.1111 > my_machine.39028: Flags [S.], seq 1237095303, ack 3047880927, win 28960, options [mss 1460,sackOK,TS val 798396021 ecr 3240732819,nop,wscale 9], length 0
09:22:12.850336 IP my_machine.39028 > 10.0.0.1.1111: Flags [.], ack 1, win 229, options [nop,nop,TS val 3240732829 ecr 798396021], length 0
09:22:12.850428 IP my_machine.39028 > 10.0.0.1.1111: Flags [P.], seq 1:171, ack 1, win 229, options [nop,nop,TS val 3240732829 ecr 798396021], length 170
```
I will try to add more info later today and hopefully also the docker-compose...

**Comment by oblazek** [comment]
Hi again, I just created a repo for reproducing this issue: https://github.com/oblazek/envoy-testing
Follow README.md inside... (1 container runs envoy, 1 container runs nginx serving static ~512MB file -- but tested few sizes bigger than 200MB and problem was the same)

**Comment by alyssawilk** [comment]
I'll try to take a look this week - if nothing else it might be useful to have a multi-GB upload/download test to make sure to avoid overflow issues.

**Comment by oblazek** [comment]
```
envoy_1    | [2019-08-12 20:13:00.219][16][debug][pool] [source/common/http/http1/conn_pool.cc:89] creating a new connection
envoy_1    | [2019-08-12 20:13:00.220][16][debug][client] [source/common/http/codec_client.cc:26] [C6] connecting
envoy_1    | [2019-08-12 20:13:00.220][16][debug][connection] [source/common/network/connection_impl.cc:702] [C6] connecting to 127.0.0.1:80
envoy_1    | [2019-08-12 20:13:00.220][16][debug][connection] [source/common/network/connection_impl.cc:711] [C6] connection in progress
envoy_1    | [2019-08-12 20:13:00.220][16][debug][pool] [source/common/http/conn_pool_base.cc:20] queueing request due to no available connections
envoy_1    | [2019-08-12 20:13:00.220][16][debug][connection] [source/common/network/connection_impl.cc:550] [C6] connected
envoy_1    | [2019-08-12 20:13:00.220][16][debug][client] [source/common/http/codec_client.cc:64] [C6] connected
envoy_1    | [2019-08-12 20:13:00.220][16][debug][pool] [source/common/http/http1/conn_pool.cc:242] [C6] attaching to next request
envoy_1    | [2019-08-12 20:13:00.220][16][debug][router] [source/common/router/router.cc:1542] [C5][S16668241748829879228] pool ready
envoy_1    | [2019-08-12 20:13:00.223][16][debug][router] [source/common/router/router.cc:1002] [C5][S16668241748829879228] upstream headers complete: end_stream=false
envoy_1    | [2019-08-12 20:13:00.223][16][debug][http] [source/common/http/conn_manager_impl.cc:1415] [C5][S16668241748829879228] encoding headers via codec (end_stream=false):
envoy_1    | ':status', '200'
envoy_1    | 'server', 'envoy'
envoy_1    | 'date', 'Mon, 12 Aug 2019 20:12:59 GMT'
envoy_1    | 'content-type', 'application/octet-stream'
envoy_1    | 'content-length', '536870912'
envoy_1    | 'last-modified', 'Mon, 12 Aug 2019 13:12:32 GMT'
envoy_1    | 'etag', '"5d5165c0-20000000"'
envoy_1    | 'accept-ranges', 'bytes'
envoy_1    | 'x-envoy-upstream-service-time', '3'
envoy_1    | 
envoy_1    | [2019-08-12 20:13:00.224][16][debug][connection] [source/common/network/connection_impl.cc:447] [C5] onAboveWriteBufferHighWatermark
envoy_1    | [2019-08-12 20:13:00.224][16][debug][http] [source/common/http/conn_manager_impl.cc:1650] [C5][S16668241748829879228] Disabling upstream stream due to downstream stream watermark.
envoy_1    | [2019-08-12 20:13:00.225][16][debug][connection] [source/common/network/connection_impl.cc:438] [C5] onBelowWriteBufferLowWatermark
envoy_1    | [2019-08-12 20:13:00.225][16][debug][http] [source/common/http/conn_manager_impl.cc:1655] [C5][S16668241748829879228] Enabling upstream stream due to downstream stream watermark.
envoy_1    | [2019-08-12 20:13:00.229][16][debug][connection] [source/common/network/connection_impl.cc:447] [C5] onAboveWriteBufferHighWatermark
envoy_1    | [2019-08-12 20:13:00.229][16][debug][http] [source/common/http/conn_manager_impl.cc:1650] [C5][S16668241748829879228] Disabling upstream stream due to downstream stream watermark.
envoy_1    | [2019-08-12 20:13:00.233][16][debug][connection] [source/common/network/connection_impl.cc:438] [C5] onBelowWriteBufferLowWatermark
envoy_1    | [2019-08-12 20:13:00.233][16][debug][http] [source/common/http/conn_manager_impl.cc:1655] [C5][S16668241748829879228] Enabling upstream stream due to downstream stream watermark.
envoy_1    | [2019-08-12 20:13:00.237][16][debug][connection] [source/common/network/connection_impl.cc:447] [C5] onAboveWriteBufferHighWatermark
envoy_1    | [2019-08-12 20:13:00.237][16][debug][http] [source/common/http/conn_manager_impl.cc:1650] [C5][S16668241748829879228] Disabling upstream stream due to downstream stream watermark.
envoy_1    | [2019-08-12 20:13:00.275][16][debug][connection] [source/common/network/connection_impl.cc:438] [C5] onBelowWriteBufferLowWatermark
envoy_1    | [2019-08-12 20:13:00.276][16][debug][http] [source/common/http/conn_manager_impl.cc:1655] [C5][S16668241748829879228] Enabling upstream stream due to downstream stream watermark.
envoy_1    | [2019-08-12 20:13:00.279][16][debug][connection] [source/common/network/connection_impl.cc:447] [C5] onAboveWriteBufferHighWatermark
envoy_1    | [2019-08-12 20:13:00.279][16][debug][http] [source/common/http/conn_manager_impl.cc:1650] [C5][S16668241748829879228] Disabling upstream stream due to downstream stream watermark.
envoy_1    | [2019-08-12 20:13:00.281][16][debug][connection] [source/common/network/connection_impl.cc:438] [C5] onBelowWriteBufferLowWatermark
envoy_1    | [2019-08-12 20:13:00.281][16][debug][http] [source/common/http/conn_manager_impl.cc:1655] [C5][S16668241748829879228] Enabling upstream stream due to downstream stream watermark.
envoy_1    | [2019-08-12 20:13:00.283][16][debug][connection] [source/common/network/connection_impl.cc:447] [C5] onAboveWriteBufferHighWatermark
envoy_1    | [2019-08-12 20:13:00.283][16][debug][http] [source/common/http/conn_manager_impl.cc:1650] [C5][S16668241748829879228] Disabling upstream stream due to downstream stream watermark.
envoy_1    | [2019-08-12 20:13:00.356][16][debug][connection] [source/common/network/connection_impl.cc:438] [C5] onBelowWriteBufferLowWatermark
envoy_1    | [2019-08-12 20:13:00.356][16][debug][http] [source/common/http/conn_manager_impl.cc:1655] [C5][S16668241748829879228] Enabling upstream stream due to downstream stream watermark.
envoy_1    | [2019-08-12 20:13:00.358][16][debug][connection] [source/common/network/connection_impl.cc:447] [C5] onAboveWriteBufferHighWatermark
envoy_1    | [2019-08-12 20:13:00.358][16][debug][http] [source/common/http/conn_manager_impl.cc:1650] [C5][S16668241748829879228] Disabling upstream stream due to downstream stream watermark.
envoy_1    | [2019-08-12 20:13:00.638][16][debug][connection] [source/common/network/connection_impl.cc:438] [C5] onBelowWriteBufferLowWatermark
envoy_1    | [2019-08-12 20:13:00.638][16][debug][http] [source/common/http/conn_manager_impl.cc:1655] [C5][S16668241748829879228] Enabling upstream stream due to downstream stream watermark.
envoy_1    | [2019-08-12 20:13:00.639][16][debug][connection] [source/common/network/connection_impl.cc:447] [C5] onAboveWriteBufferHighWatermark
envoy_1    | [2019-08-12 20:13:00.639][16][debug][http] [source/common/http/conn_manager_impl.cc:1650] [C5][S16668241748829879228] Disabling upstream stream due to downstream stream watermark.
envoy_1    | [2019-08-12 20:13:02.072][16][debug][connection] [source/common/network/connection_impl.cc:438] [C5] onBelowWriteBufferLowWatermark
envoy_1    | [2019-08-12 20:13:02.072][16][debug][http] [source/common/http/conn_manager_impl.cc:1655] [C5][S16668241748829879228] Enabling upstream stream due to downstream stream watermark.
envoy_1    | [2019-08-12 20:13:02.074][16][debug][connection] [source/common/network/connection_impl.cc:447] [C5] onAboveWriteBufferHighWatermark
envoy_1    | [2019-08-12 20:13:02.074][16][debug][http] [source/common/http/conn_manager_impl.cc:1650] [C5][S16668241748829879228] Disabling upstream stream due to downstream stream watermark.
envoy_1    | [2019-08-12 20:13:03.505][16][debug][connection] [source/common/network/connection_impl.cc:438] [C5] onBelowWriteBufferLowWatermark
envoy_1    | [2019-08-12 20:13:03.505][16][debug][http] [source/common/http/conn_manager_impl.cc:1655] [C5][S16668241748829879228] Enabling upstream stream due to downstream stream watermark.
envoy_1    | [2019-08-12 20:13:03.510][16][debug][connection] [source/common/network/connection_impl.cc:447] [C5] onAboveWriteBufferHighWatermark
envoy_1    | [2019-08-12 20:13:03.510][16][debug][http] [source/common/http/conn_manager_impl.cc:1650] [C5][S16668241748829879228] Disabling upstream stream due to downstream stream watermark.
envoy_1    | [2019-08-12 20:13:04.744][1][debug][main] [source/server/server.cc:169] flushing stats
envoy_1    | [2019-08-12 20:13:05.144][16][debug][connection] [source/common/network/connection_impl.cc:438] [C5] onBelowWriteBufferLowWatermark
envoy_1    | [2019-08-12 20:13:05.144][16][debug][http] [source/common/http/conn_manager_impl.cc:1655] [C5][S16668241748829879228] Enabling upstream stream due to downstream stream watermark.
envoy_1    | [2019-08-12 20:13:05.146][16][debug][connection] [source/common/network/connection_impl.cc:447] [C5] onAboveWriteBufferHighWatermark
envoy_1    | [2019-08-12 20:13:05.146][16][debug][http] [source/common/http/conn_manager_impl.cc:1650] [C5][S16668241748829879228] Disabling upstream stream due to downstream stream watermark.
envoy_1    | [2019-08-12 20:13:06.577][16][debug][connection] [source/common/network/connection_impl.cc:438] [C5] onBelowWriteBufferLowWatermark
envoy_1    | [2019-08-12 20:13:06.577][16][debug][http] [source/common/http/conn_manager_impl.cc:1655] [C5][S16668241748829879228] Enabling upstream stream due to downstream stream watermark.
envoy_1    | [2019-08-12 20:13:06.583][16][debug][connection] [source/common/network/connection_impl.cc:447] [C5] onAboveWriteBufferHighWatermark
envoy_1    | [2019-08-12 20:13:06.583][16][debug][http] [source/common/http/conn_manager_impl.cc:1650] [C5][S16668241748829879228] Disabling upstream stream due to downstream stream watermark.
envoy_1    | [2019-08-12 20:13:08.216][16][debug][connection] [source/common/network/connection_impl.cc:438] [C5] onBelowWriteBufferLowWatermark
envoy_1    | [2019-08-12 20:13:08.216][16][debug][http] [source/common/http/conn_manager_impl.cc:1655] [C5][S16668241748829879228] Enabling upstream stream due to downstream stream watermark.
envoy_1    | [2019-08-12 20:13:08.218][16][debug][connection] [source/common/network/connection_impl.cc:447] [C5] onAboveWriteBufferHighWatermark
envoy_1    | [2019-08-12 20:13:08.218][16][debug][http] [source/common/http/conn_manager_impl.cc:1650] [C5][S16668241748829879228] Disabling upstream stream due to downstream stream watermark.
envoy_1    | [2019-08-12 20:13:09.748][1][debug][main] [source/server/server.cc:169] flushing stats
envoy_1    | [2019-08-12 20:13:09.896][16][debug][connection] [source/common/network/connection_impl.cc:438] [C5] onBelowWriteBufferLowWatermark
envoy_1    | [2019-08-12 20:13:09.896][16][debug][http] [source/common/http/conn_manager_impl.cc:1655] [C5][S16668241748829879228] Enabling upstream stream due to downstream stream watermark.
envoy_1    | [2019-08-12 20:13:09.900][16][debug][connection] [source/common/network/connection_impl.cc:447] [C5] onAboveWriteBufferHighWatermark
envoy_1    | [2019-08-12 20:13:09.900][16][debug][http] [source/common/http/conn_manager_impl.cc:1650] [C5][S16668241748829879228] Disabling upstream stream due to downstream stream watermark.
envoy_1    | [2019-08-12 20:13:11.288][16][debug][connection] [source/common/network/connection_impl.cc:438] [C5] onBelowWriteBufferLowWatermark
envoy_1    | [2019-08-12 20:13:11.288][16][debug][http] [source/common/http/conn_manager_impl.cc:1655] [C5][S16668241748829879228] Enabling upstream stream due to downstream stream watermark.
envoy_1    | [2019-08-12 20:13:11.290][16][debug][connection] [source/common/network/connection_impl.cc:447] [C5] onAboveWriteBufferHighWatermark
envoy_1    | [2019-08-12 20:13:11.290][16][debug][http] [source/common/http/conn_manager_impl.cc:1650] [C5][S16668241748829879228] Disabling upstream stream due to downstream stream watermark.
envoy_1    | [2019-08-12 20:13:13.131][16][debug][connection] [source/common/network/connection_impl.cc:438] [C5] onBelowWriteBufferLowWatermark
envoy_1    | [2019-08-12 20:13:13.131][16][debug][http] [source/common/http/conn_manager_impl.cc:1655] [C5][S16668241748829879228] Enabling upstream stream due to downstream stream watermark.
envoy_1    | [2019-08-12 20:13:13.136][16][debug][connection] [source/common/network/connection_impl.cc:447] [C5] onAboveWriteBufferHighWatermark
envoy_1    | [2019-08-12 20:13:13.136][16][debug][http] [source/common/http/conn_manager_impl.cc:1650] [C5][S16668241748829879228] Disabling upstream stream due to downstream stream watermark.
envoy_1    | [2019-08-12 20:13:14.752][1][debug][main] [source/server/server.cc:169] flushing stats
envoy_1    | [2019-08-12 20:13:14.769][16][debug][connection] [source/common/network/connection_impl.cc:438] [C5] onBelowWriteBufferLowWatermark
envoy_1    | [2019-08-12 20:13:14.769][16][debug][http] [source/common/http/conn_manager_impl.cc:1655] [C5][S16668241748829879228] Enabling upstream stream due to downstream stream watermark.
envoy_1    | [2019-08-12 20:13:14.775][16][debug][connection] [source/common/network/connection_impl.cc:447] [C5] onAboveWriteBufferHighWatermark
envoy_1    | [2019-08-12 20:13:14.775][16][debug][http] [source/common/http/conn_manager_impl.cc:1650] [C5][S16668241748829879228] Disabling upstream stream due to downstream stream watermark.
envoy_1    | [2019-08-12 20:13:15.219][16][debug][router] [source/common/router/router.cc:689] [C5][S16668241748829879228] upstream timeout
envoy_1    | [2019-08-12 20:13:15.220][16][debug][router] [source/common/router/router.cc:1491] [C5][S16668241748829879228] resetting pool request
envoy_1    | [2019-08-12 20:13:15.220][16][debug][client] [source/common/http/codec_client.cc:105] [C6] request reset
envoy_1    | [2019-08-12 20:13:15.220][16][debug][connection] [source/common/network/connection_impl.cc:101] [C6] closing data_to_write=0 type=1
envoy_1    | [2019-08-12 20:13:15.220][16][debug][connection] [source/common/network/connection_impl.cc:188] [C6] closing socket: 1
envoy_1    | [2019-08-12 20:13:15.220][16][debug][client] [source/common/http/codec_client.cc:82] [C6] disconnect. resetting 0 pending requests
envoy_1    | [2019-08-12 20:13:15.220][16][debug][pool] [source/common/http/http1/conn_pool.cc:130] [C6] client disconnected, failure reason: 
envoy_1    | [2019-08-12 20:13:15.221][16][debug][http] [source/common/http/conn_manager_impl.cc:188] [C5][S16668241748829879228] doEndStream() resetting stream
envoy_1    | [2019-08-12 20:13:15.221][16][debug][http] [source/common/http/conn_manager_impl.cc:1644] [C5][S16668241748829879228] stream reset
envoy_1    | [2019-08-12 20:13:15.221][16][debug][connection] [source/common/network/connection_impl.cc:101] [C5] closing data_to_write=1983058 type=2
envoy_1    | [2019-08-12 20:13:15.221][16][debug][connection] [source/common/network/connection_impl.cc:651] [C5] setting delayed close timer with timeout 1000 ms
envoy_1    | [2019-08-12 20:13:16.224][16][debug][connection] [source/common/network/connection_impl.cc:640] [C5] triggered delayed close
envoy_1    | [2019-08-12 20:13:16.224][16][debug][connection] [source/common/network/connection_impl.cc:188] [C5] closing socket: 1
envoy_1    | [2019-08-12 20:13:16.224][16][debug][main] [source/server/connection_handler_impl.cc:80] [C5] adding to cleanup list
envoy_1    | [2019-08-12 20:13:19.756][1][debug][main] [source/server/server.cc:169] flushing stats
envoy_1    | [2019-08-12 20:13:24.760][1][debug][main] [source/server/server.cc:169] flushing stats
envoy_1    | [2019-08-12 20:13:25.395][15][debug][main] [source/server/connection_handler_impl.cc:280] [C7] new connection
envoy_1    | [2019-08-12 20:13:25.395][15][debug][http] [source/common/http/conn_manager_impl.cc:247] [C7] new stream
envoy_1    | [2019-08-12 20:13:25.395][15][debug][http] [source/common/http/conn_manager_impl.cc:601] [C7][S7349913083430480494] request headers complete (end_stream=true):
envoy_1    | ':authority', '127.0.0.1:1111'
envoy_1    | ':path', '/data'
envoy_1    | ':method', 'GET'
envoy_1    | 'range', 'bytes=24231078-'
envoy_1    | 'user-agent', 'Wget/1.19.4 (linux-gnu)'
envoy_1    | 'accept', '*/*'
envoy_1    | 'accept-encoding', 'identity'
envoy_1    | 'connection', 'Keep-Alive'
envoy_1    | 
envoy_1    | [2019-08-12 20:13:25.395][15][debug][http] [source/common/http/conn_manager_impl.cc:1148] [C7][S7349913083430480494] request end stream
envoy_1    | [2019-08-12 20:13:25.396][15][debug][router] [source/common/router/router.cc:402] [C7][S7349913083430480494] cluster 'demo' match for URL '/data'
envoy_1    | [2019-08-12 20:13:25.396][15][debug][router] [source/common/router/router.cc:515] [C7][S7349913083430480494] router decoding headers:
envoy_1    | ':authority', '127.0.0.1:1111'
envoy_1    | ':path', '/data'
envoy_1    | ':method', 'GET'
envoy_1    | ':scheme', 'http'
envoy_1    | 'range', 'bytes=24231078-'
envoy_1    | 'user-agent', 'Wget/1.19.4 (linux-gnu)'
envoy_1    | 'accept', '*/*'
envoy_1    | 'accept-encoding', 'identity'
envoy_1    | 'x-forwarded-proto', 'http'
envoy_1    | 'x-request-id', '60e0ca34-0d6e-42f6-8651-ca1795d5705f'
envoy_1    | 'x-envoy-expected-rq-timeout-ms', '15000'
envoy_1    | 
envoy_1    | [2019-08-12 20:13:25.396][15][debug][pool] [source/common/http/http1/conn_pool.cc:89] creating a new connection
envoy_1    | [2019-08-12 20:13:25.396][15][debug][client] [source/common/http/codec_client.cc:26] [C8] connecting
envoy_1    | [2019-08-12 20:13:25.396][15][debug][connection] [source/common/network/connection_impl.cc:702] [C8] connecting to 127.0.0.1:80
envoy_1    | [2019-08-12 20:13:25.396][15][debug][connection] [source/common/network/connection_impl.cc:711] [C8] connection in progress
envoy_1    | [2019-08-12 20:13:25.396][15][debug][pool] [source/common/http/conn_pool_base.cc:20] queueing request due to no available connections
envoy_1    | [2019-08-12 20:13:25.396][15][debug][connection] [source/common/network/connection_impl.cc:550] [C8] connected
envoy_1    | [2019-08-12 20:13:25.396][15][debug][client] [source/common/http/codec_client.cc:64] [C8] connected
envoy_1    | [2019-08-12 20:13:25.396][15][debug][pool] [source/common/http/http1/conn_pool.cc:242] [C8] attaching to next request
envoy_1    | [2019-08-12 20:13:25.396][15][debug][router] [source/common/router/router.cc:1542] [C7][S7349913083430480494] pool ready
envoy_1    | [2019-08-12 20:13:25.400][15][debug][router] [source/common/router/router.cc:1002] [C7][S7349913083430480494] upstream headers complete: end_stream=false
envoy_1    | [2019-08-12 20:13:25.401][15][debug][http] [source/common/http/conn_manager_impl.cc:1415] [C7][S7349913083430480494] encoding headers via codec (end_stream=false):
envoy_1    | ':status', '206'
envoy_1    | 'server', 'envoy'
envoy_1    | 'date', 'Mon, 12 Aug 2019 20:13:25 GMT'
envoy_1    | 'content-type', 'application/octet-stream'
envoy_1    | 'content-length', '512639834'
envoy_1    | 'last-modified', 'Mon, 12 Aug 2019 13:12:32 GMT'
envoy_1    | 'etag', '"5d5165c0-20000000"'
envoy_1    | 'content-range', 'bytes 24231078-536870911/536870912'
envoy_1    | 'x-envoy-upstream-service-time', '4'
envoy_1    | 
envoy_1    | [2019-08-12 20:13:25.401][15][debug][connection] [source/common/network/connection_impl.cc:447] [C7] onAboveWriteBufferHighWatermark
envoy_1    | [2019-08-12 20:13:25.402][15][debug][http] [source/common/http/conn_manager_impl.cc:1650] [C7][S7349913083430480494] Disabling upstream stream due to downstream stream watermark.
envoy_1    | [2019-08-12 20:13:25.402][15][debug][connection] [source/common/network/connection_impl.cc:438] [C7] onBelowWriteBufferLowWatermark
envoy_1    | [2019-08-12 20:13:25.402][15][debug][http] [source/common/http/conn_manager_impl.cc:1655] [C7][S7349913083430480494] Enabling upstream stream due to downstream stream watermark.
envoy_1    | [2019-08-12 20:13:25.407][15][debug][connection] [source/common/network/connection_impl.cc:447] [C7] onAboveWriteBufferHighWatermark
envoy_1    | [2019-08-12 20:13:25.407][15][debug][http] [source/common/http/conn_manager_impl.cc:1650] [C7][S7349913083430480494] Disabling upstream stream due to downstream stream watermark.
envoy_1    | [2019-08-12 20:13:25.412][15][debug][connection] [source/common/network/connection_impl.cc:438] [C7] onBelowWriteBufferLowWatermark
envoy_1    | [2019-08-12 20:13:25.412][15][debug][http] [source/common/http/conn_manager_impl.cc:1655] [C7][S7349913083430480494] Enabling upstream stream due to downstream stream watermark.
envoy_1    | [2019-08-12 20:13:25.416][15][debug][connection] [source/common/network/connection_impl.cc:447] [C7] onAboveWriteBufferHighWatermark
envoy_1    | [2019-08-12 20:13:25.416][15][debug][http] [source/common/http/conn_manager_impl.cc:1650] [C7][S7349913083430480494] Disabling upstream stream due to downstream stream watermark.
envoy_1    | [2019-08-12 20:13:25.452][15][debug][connection] [source/common/network/connection_impl.cc:438] [C7] onBelowWriteBufferLowWatermark
envoy_1    | [2019-08-12 20:13:25.452][15][debug][http] [source/common/http/conn_manager_impl.cc:1655] [C7][S7349913083430480494] Enabling upstream stream due to downstream stream watermark.
envoy_1    | [2019-08-12 20:13:25.456][15][debug][connection] [source/common/network/connection_impl.cc:447] [C7] onAboveWriteBufferHighWatermark
envoy_1    | [2019-08-12 20:13:25.456][15][debug][http] [source/common/http/conn_manager_impl.cc:1650] [C7][S7349913083430480494] Disabling upstream stream due to downstream stream watermark.
envoy_1    | [2019-08-12 20:13:25.457][15][debug][connection] [source/common/network/connection_impl.cc:438] [C7] onBelowWriteBufferLowWatermark
envoy_1    | [2019-08-12 20:13:25.457][15][debug][http] [source/common/http/conn_manager_impl.cc:1655] [C7][S7349913083430480494] Enabling upstream stream due to downstream stream watermark.
envoy_1    | [2019-08-12 20:13:25.459][15][debug][connection] [source/common/network/connection_impl.cc:447] [C7] onAboveWriteBufferHighWatermark
envoy_1    | [2019-08-12 20:13:25.459][15][debug][http] [source/common/http/conn_manager_impl.cc:1650] [C7][S7349913083430480494] Disabling upstream stream due to downstream stream watermark.
envoy_1    | [2019-08-12 20:13:25.611][15][debug][connection] [source/common/network/connection_impl.cc:438] [C7] onBelowWriteBufferLowWatermark
envoy_1    | [2019-08-12 20:13:25.611][15][debug][http] [source/common/http/conn_manager_impl.cc:1655] [C7][S7349913083430480494] Enabling upstream stream due to downstream stream watermark.
envoy_1    | [2019-08-12 20:13:25.615][15][debug][connection] [source/common/network/connection_impl.cc:447] [C7] onAboveWriteBufferHighWatermark
envoy_1    | [2019-08-12 20:13:25.615][15][debug][http] [source/common/http/conn_manager_impl.cc:1650] [C7][S7349913083430480494] Disabling upstream stream due to downstream stream watermark.
envoy_1    | [2019-08-12 20:13:26.226][15][debug][connection] [source/common/network/connection_impl.cc:438] [C7] onBelowWriteBufferLowWatermark
envoy_1    | [2019-08-12 20:13:26.226][15][debug][http] [source/common/http/conn_manager_impl.cc:1655] [C7][S7349913083430480494] Enabling upstream stream due to downstream stream watermark.
envoy_1    | [2019-08-12 20:13:26.228][15][debug][connection] [source/common/network/connection_impl.cc:447] [C7] onAboveWriteBufferHighWatermark
envoy_1    | [2019-08-12 20:13:26.229][15][debug][http] [source/common/http/conn_manager_impl.cc:1650] [C7][S7349913083430480494] Disabling upstream stream due to downstream stream watermark.
envoy_1    | [2019-08-12 20:13:27.658][15][debug][connection] [source/common/network/connection_impl.cc:438] [C7] onBelowWriteBufferLowWatermark
envoy_1    | [2019-08-12 20:13:27.658][15][debug][http] [source/common/http/conn_manager_impl.cc:1655] [C7][S7349913083430480494] Enabling upstream stream due to downstream stream watermark.
envoy_1    | [2019-08-12 20:13:27.660][15][debug][connection] [source/common/network/connection_impl.cc:447] [C7] onAboveWriteBufferHighWatermark
envoy_1    | [2019-08-12 20:13:27.660][15][debug][http] [source/common/http/conn_manager_impl.cc:1650] [C7][S7349913083430480494] Disabling upstream stream due to downstream stream watermark.
envoy_1    | [2019-08-12 20:13:28.752][15][debug][misc] [source/common/network/io_socket_error_impl.cc:29] Unknown error code 104 details Connection reset by peer
envoy_1    | [2019-08-12 20:13:28.752][15][debug][connection] [source/common/network/connection_impl.cc:188] [C7] closing socket: 0
envoy_1    | [2019-08-12 20:13:28.752][15][debug][http] [source/common/http/conn_manager_impl.cc:1644] [C7][S7349913083430480494] stream reset
envoy_1    | [2019-08-12 20:13:28.752][15][debug][router] [source/common/router/router.cc:1491] [C7][S7349913083430480494] resetting pool request
envoy_1    | [2019-08-12 20:13:28.753][15][debug][client] [source/common/http/codec_client.cc:105] [C8] request reset
envoy_1    | [2019-08-12 20:13:28.753][15][debug][connection] [source/common/network/connection_impl.cc:101] [C8] closing data_to_write=0 type=1
envoy_1    | [2019-08-12 20:13:28.753][15][debug][connection] [source/common/network/connection_impl.cc:188] [C8] closing socket: 1
envoy_1    | [2019-08-12 20:13:28.754][15][debug][client] [source/common/http/codec_client.cc:82] [C8] disconnect. resetting 0 pending requests
envoy_1    | [2019-08-12 20:13:28.754][15][debug][pool] [source/common/http/http1/conn_pool.cc:130] [C8] client disconnected, failure reason: 
envoy_1    | [2019-08-12 20:13:28.754][15][debug][main] [source/server/connection_handler_impl.cc:80] [C7] adding to cleanup list
envoy_1    | [2019-08-12 20:13:29.764][1][debug][main] [source/server/server.cc:169] flushing stats
```
here is a debug output.. do I get it right, that the connection simply timed out because of some timeout settings for upstream?

I am using `connect_timeout` in my configuration and tried using `timeout` in my `filter/routes` config like this: 
```
static_resources:                                                                                   
  listeners:                                                                                        
  - name: demo1                                                                                     
    address:                                                                                        
      socket_address:                                                                               
        address: 127.0.0.1                                                                          
        port_value: 1111                                                                            
    filter_chains:                                                                                  
    - filters:                                                                                      
      - name: envoy.http_connection_manager                                                         
        config:                                                                                     
          codec_type: auto                                                                          
          stat_prefix: ingress_http                                                                 
          route_config:                                                                             
            name: local_route                                                                       
            virtual_hosts:                                                                          
            - name: backend                                                                         
              domains:                                                                              
              - "*"                                                                                 
              routes:                                                                               
              - match:                                                                              
                  prefix: "/"                                                                       
                route:                                                                              
                  cluster: demo                                                                     
                timeout: 1000                                                                    
          http_filters:                                                                             
          - name: envoy.router
```
but that did not seem to work..is it so that I somehow have to only increase the default value? .. any idea how to do that? which one? 
I also tried using `Timeout` in `Route` action next to `ClusterSpecifier` in xDS, but without any luck :(
 
Thanks a lot.

**Comment by alyssawilk** [comment]
Looking at this, it looks to me like you have a fast upstream and slow client (we keep disabling upstream due to downstream watermark, so the downstream connection buffer was full), and eventually the upstream disconnected*.   It's still possible there's some tangle where no bytes are being read (I may add trace logs for actual read disable) but at first glance it looks like your upstream itself gave up and closed the connection, perhaps due to an overall respone timeout?

*[source/common/network/io_socket_error_impl.cc:29] Unknown error code 104 details Connection reset by peer
[source/common/http/http1/conn_pool.cc:130] [C8] client disconnected, failure reason:

**Comment by oblazek** [comment]
I am not sure.. usually I don't see any `Connection reset by peer` but something like this: 
```
envoy_1    | [2019-08-13 05:39:55.899][12][debug][http] [source/common/http/conn_manager_impl.cc:1650] [C3][S7246568513922345343] Disabling upstream stream due to downstream stream watermark.
envoy_1    | [2019-08-13 05:39:56.108][12][debug][connection] [source/common/network/connection_impl.cc:438] [C3] onBelowWriteBufferLowWatermark
envoy_1    | [2019-08-13 05:39:56.108][12][debug][http] [source/common/http/conn_manager_impl.cc:1655] [C3][S7246568513922345343] Enabling upstream stream due to downstream stream watermark.
envoy_1    | [2019-08-13 05:39:56.113][12][debug][connection] [source/common/network/connection_impl.cc:447] [C3] onAboveWriteBufferHighWatermark
envoy_1    | [2019-08-13 05:39:56.113][12][debug][http] [source/common/http/conn_manager_impl.cc:1650] [C3][S7246568513922345343] Disabling upstream stream due to downstream stream watermark.
envoy_1    | [2019-08-13 05:39:56.176][12][debug][router] [source/common/router/router.cc:689] [C3][S7246568513922345343] upstream timeout
envoy_1    | [2019-08-13 05:39:56.176][12][debug][router] [source/common/router/router.cc:1491] [C3][S7246568513922345343] resetting pool request
envoy_1    | [2019-08-13 05:39:56.176][12][debug][client] [source/common/http/codec_client.cc:105] [C4] request reset
envoy_1    | [2019-08-13 05:39:56.176][12][debug][connection] [source/common/network/connection_impl.cc:101] [C4] closing data_to_write=0 type=1
envoy_1    | [2019-08-13 05:39:56.176][12][debug][connection] [source/common/network/connection_impl.cc:188] [C4] closing socket: 1
backend_1  | 127.0.0.1 - - [13/Aug/2019:05:39:56 +0000] "GET /data HTTP/1.1" 206 172540186 "-" "Wget/1.19.4 (linux-gnu)" "-"
envoy_1    | [2019-08-13 05:39:56.176][12][debug][client] [source/common/http/codec_client.cc:82] [C4] disconnect. resetting 0 pending requests
envoy_1    | [2019-08-13 05:39:56.176][12][debug][pool] [source/common/http/http1/conn_pool.cc:130] [C4] client disconnected, failure reason: 
envoy_1    | [2019-08-13 05:39:56.176][12][debug][http] [source/common/http/conn_manager_impl.cc:188] [C3][S7246568513922345343] doEndStream() resetting stream
envoy_1    | [2019-08-13 05:39:56.176][12][debug][http] [source/common/http/conn_manager_impl.cc:1644] [C3][S7246568513922345343] stream reset
envoy_1    | [2019-08-13 05:39:56.176][12][debug][connection] [source/common/network/connection_impl.cc:101] [C3] closing data_to_write=1369125 type=2
envoy_1    | [2019-08-13 05:39:56.176][12][debug][connection] [source/common/network/connection_impl.cc:651] [C3] setting delayed close timer with timeout 1000 ms
envoy_1    | [2019-08-13 05:39:56.320][12][debug][connection] [source/common/network/connection_impl.cc:438] [C3] onBelowWriteBufferLowWatermark
envoy_1    | [2019-08-13 05:39:56.320][12][debug][connection] [source/common/network/connection_impl.cc:580] [C3] write flush complete
envoy_1    | [2019-08-13 05:39:56.480][1][debug][main] [source/server/server.cc:169] flushing stats
envoy_1    | [2019-08-13 05:39:57.324][12][debug][connection] [source/common/network/connection_impl.cc:640] [C3] triggered delayed close
envoy_1    | [2019-08-13 05:39:57.324][12][debug][connection] [source/common/network/connection_impl.cc:188] [C3] closing socket: 1
envoy_1    | [2019-08-13 05:39:57.324][12][debug][main] [source/server/connection_handler_impl.cc:80] [C3] adding to cleanup list
envoy_1    | [2019-08-13 05:39:59.375][16][debug][main] [source/server/connection_handler_impl.cc:280] [C5] new connection
envoy_1    | [2019-08-13 05:39:59.375][16][debug][http] [source/common/http/conn_manager_impl.cc:247] [C5] new stream
envoy_1    | [2019-08-13 05:39:59.375][16][debug][http] [source/common/http/conn_manager_impl.cc:601] [C5][S2569750709197472779] request headers complete (end_stream=true):
envoy_1    | ':authority', '127.0.0.1:1111'
envoy_1    | ':path', '/data'
envoy_1    | ':method', 'GET'
envoy_1    | 'range', 'bytes=324009413-'
envoy_1    | 'user-agent', 'Wget/1.19.4 (linux-gnu)'
envoy_1    | 'accept', '*/*'
envoy_1    | 'accept-encoding', 'identity'
envoy_1    | 'connection', 'Keep-Alive'
envoy_1    | 
envoy_1    | [2019-08-13 05:39:59.375][16][debug][http] [source/common/http/conn_manager_impl.cc:1148] [C5][S2569750709197472779] request end stream
envoy_1    | [2019-08-13 05:39:59.375][16][debug][router] [source/common/router/router.cc:402] [C5][S2569750709197472779] cluster 'demo' match for URL '/data'
envoy_1    | [2019-08-13 05:39:59.375][16][debug][router] [source/common/router/router.cc:515] [C5][S2569750709197472779] router decoding headers:
envoy_1    | ':authority', '127.0.0.1:1111'
envoy_1    | ':path', '/data'
envoy_1    | ':method', 'GET'
envoy_1    | ':scheme', 'http'
envoy_1    | 'range', 'bytes=324009413-'
envoy_1    | 'user-agent', 'Wget/1.19.4 (linux-gnu)'
envoy_1    | 'accept', '*/*'
envoy_1    | 'accept-encoding', 'identity'
envoy_1    | 'x-forwarded-proto', 'http'
envoy_1    | 'x-request-id', 'b094d58a-99dc-41c2-812f-a406fe88c06e'
envoy_1    | 'x-envoy-expected-rq-timeout-ms', '15000'
envoy_1    | 
envoy_1    | [2019-08-13 05:39:59.375][16][debug][pool] [source/common/http/http1/conn_pool.cc:89] creating a new connection
envoy_1    | [2019-08-13 05:39:59.375][16][debug][client] [source/common/http/codec_client.cc:26] [C6] connecting
envoy_1    | [2019-08-13 05:39:59.375][16][debug][connection] [source/common/network/connection_impl.cc:702] [C6] connecting to 127.0.0.1:80
envoy_1    | [2019-08-13 05:39:59.375][16][debug][connection] [source/common/network/connection_impl.cc:711] [C6] connection in progress
envoy_1    | [2019-08-13 05:39:59.376][16][debug][pool] [source/common/http/conn_pool_base.cc:20] queueing request due to no available connections
envoy_1    | [2019-08-13 05:39:59.376][16][debug][connection] [source/common/network/connection_impl.cc:550] [C6] connected
envoy_1    | [2019-08-13 05:39:59.376][16][debug][client] [source/common/http/codec_client.cc:64] [C6] connected
envoy_1    | [2019-08-13 05:39:59.376][16][debug][pool] [source/common/http/http1/conn_pool.cc:242] [C6] attaching to next request
envoy_1    | [2019-08-13 05:39:59.376][16][debug][router] [source/common/router/router.cc:1542] [C5][S2569750709197472779] pool ready
envoy_1    | [2019-08-13 05:39:59.385][16][debug][router] [source/common/router/router.cc:1002] [C5][S2569750709197472779] upstream headers complete: end_stream=false
envoy_1    | [2019-08-13 05:39:59.385][16][debug][http] [source/common/http/conn_manager_impl.cc:1415] [C5][S2569750709197472779] encoding headers via codec (end_stream=false):
envoy_1    | ':status', '206'
envoy_1    | 'server', 'envoy'
envoy_1    | 'date', 'Tue, 13 Aug 2019 05:39:59 GMT'
envoy_1    | 'content-type', 'application/octet-stream'
envoy_1    | 'content-length', '212861499'
envoy_1    | 'last-modified', 'Mon, 12 Aug 2019 13:12:32 GMT'
envoy_1    | 'etag', '"5d5165c0-20000000"'
envoy_1    | 'content-range', 'bytes 324009413-536870911/536870912'
envoy_1    | 'x-envoy-upstream-service-time', '9'
envoy_1    | 
envoy_1    | [2019-08-13 05:39:59.389][16][debug][connection] [source/common/network/connection_impl.cc:447] [C5] onAboveWriteBufferHighWatermark
envoy_1    | [2019-08-13 05:39:59.389][16][debug][http] [source/common/http/conn_manager_impl.cc:1650] [C5][S2569750709197472779] Disabling upstream stream due to downstream stream watermark.
envoy_1    | [2019-08-13 05:39:59.390][16][debug][connection] [source/common/network/connection_impl.cc:438] [C5] onBelowWriteBufferLowWatermark
envoy_1    | [2019-08-13 05:39:59.390][16][debug][http] [source/common/http/conn_manager_impl.cc:1655] [C5][S2569750709197472779] Enabling upstream stream due to downstream stream watermark.
envoy_1    | [2019-08-13 05:39:59.395][16][debug][connection] [source/common/network/connection_impl.cc:447] [C5] onAboveWriteBufferHighWatermark
```
I am still suspecting the timeout.. If I set the `wget` speed to 20MB/s I still get connection close and I don't think this is slow at all. 
And if I try the same test multiple times the connection gets closed quite often after 15s.. 

Could you guide me where is the right place in the config to modify the [upstream timeout](https://www.envoyproxy.io/docs/envoy/latest/api-v2/api/v2/route/route.proto#envoy-api-field-route-routeaction-timeout)? Because the place I used (or different places I tried) simply didn't work for me :/
thanks

**Comment by oblazek** [comment]
Well, it was actually really just the default upstream timeout value.. I just found out the right place to put it in both static config and xDS and all works well.. Thanks a lot both of you @alyssawilk @mattklein123 :) let's close this up.

**Comment by panchn-n** [comment]
> Well, it was actually really just the default upstream timeout value.. I just found out the right place to put it in both static config and xDS and all works well.. Thanks a lot both of you @alyssawilk @mattklein123 :) let's close this up.

Would you please share the exact configuration that worked for you?

**Comment by oblazek** [comment]
We are setting this using our control plane so the static configuration - formatting/syntax might be a bit different, but the **Timeout** was the thing that solved it (we set it now to 30min which means the request have to be completed in 30min):
```
Action: &route.Route_Route{
				Route: &route.RouteAction{
					ClusterSpecifier: &route.RouteAction_Cluster{
						Cluster: clusterName,
					},
					Timeout:       &envoyCfg.UpstreamTimeout,
				},
			},
```
in the route configuration.
