### ISSUE TITLE
When i tested on gRPC stream with round_robin option, it seems that envoy cannot distribute properly

### ISSUE THREAD

**Issue by junhojang** [envoyproxy/envoy#2397]
I'm testing on gRPC stream with round_robin cluster option.
I tested 8 client and 8 server. So, i expected that client will be dsitributed to each server via envoy.
But it seems like don't distribute properly.

--------- packet cpature --------
188	2.290134927	127.0.0.1	127.0.0.1	TCP	74	56712 → 3001 [SYN] Seq=0 Win=43690 Len=0 MSS=65495 SACK_PERM=1 TSval=652841 TSecr=0 WS=128
208	2.295984037	127.0.0.1	127.0.0.1	TCP	74	34526 → 3002 [SYN] Seq=0 Win=43690 Len=0 MSS=65495 SACK_PERM=1 TSval=652843 TSecr=0 WS=128
227	2.304638407	127.0.0.1	127.0.0.1	TCP	74	56724 → 3001 [SYN] Seq=0 Win=43690 Len=0 MSS=65495 SACK_PERM=1 TSval=652845 TSecr=0 WS=128
243	2.310747799	127.0.0.1	127.0.0.1	TCP	74	43444 → 3003 [SYN] Seq=0 Win=43690 Len=0 MSS=65495 SACK_PERM=1 TSval=652847 TSecr=0 WS=128
256	2.313004140	127.0.0.1	127.0.0.1	TCP	74	43182 → 3004 [SYN] Seq=0 Win=43690 Len=0 MSS=65495 SACK_PERM=1 TSval=652847 TSecr=0 WS=128
272	2.314440390	127.0.0.1	127.0.0.1	TCP	74	45256 → 3005 [SYN] Seq=0 Win=43690 Len=0 MSS=65495 SACK_PERM=1 TSval=652847 TSecr=0 WS=128
285	2.320046905	127.0.0.1	127.0.0.1	TCP	74	51410 → 3006 [SYN] Seq=0 Win=43690 Len=0 MSS=65495 SACK_PERM=1 TSval=652849 TSecr=0 WS=128
303	2.330843987	127.0.0.1	127.0.0.1	TCP	74	56740 → 3001 [SYN] Seq=0 Win=43690 Len=0 MSS=65495 SACK_PERM=1 TSval=652852 TSecr=0 WS=128
------------------------------------------

I've setuped like below cluster options.
Can you give any hint about it?

------------------------envoy config-------------------------------
  "cluster_manager": {
     "clusters": [
      {
        "name": "local_service_grpc",
        "connect_timeout_ms": 10000,
        "type": "static",
        "lb_type": "round_robin",
        "features": "http2",
        "circuit_breakers": {
          "default": {
            "max_connections": 30000,
            "max_pending_requests": 30000,
            "max_requests": 30000
          }, 
          "high": {
            "max_connections": 30000,
            "max_pending_requests": 30000,
            "max_requests": 30000
          }
        },
        "hosts": [
          {
            "url": "tcp://127.0.0.1:3001"
          },
          {
            "url": "tcp://127.0.0.1:3002"
          },
          {
            "url": "tcp://127.0.0.1:3003"
          },
          {
            "url": "tcp://127.0.0.1:3004"
          },
          {
            "url": "tcp://127.0.0.1:3005"
          },
          {
            "url": "tcp://127.0.0.1:3006"
          },
          {
            "url": "tcp://127.0.0.1:3007"
          },
          {
            "url": "tcp://127.0.0.1:3008"
          }
        ]
      }
    ]
  }
}

-----------------------------------------------

**Comment by junhojang** [comment]
When i tested with '--concurreny 1', envoy distribute propery.
It seems that workers distribute as 'round_robin', but individually.
